Source Country,Field Of Influence,Name,Influence,log(influence),Description,UnknownFrench,Arts/Entertainment,Kyle Hebert,226214,4.799232382,"Kyle Henry Hebert  is an American voice actor and podcaster who works for anime and video game series, such as the teenage and adult Gohan and the narrator in the Funimation dub of the Dragon Ball series, S_suke Aizen in Bleach, Ryu in the Street Fighter video game series, Kiba Inuzuka in Naruto, Kamina in Gurren Lagann, and Ryuji Suguro in Blue Exorcist",356French,Sports,Jim Thorpe,224097,4.793390306,"James Francis ""Jim"" Thorpe : Wa-Tho-Huk, translated as ""Bright Path""; May 28, 1888 ",83French,Arts/Entertainment,Clarence White,216591,4.772222536,"Clarence White , was an American bluegrass and country guitarist and singer",75French,Arts/Entertainment,Joan Crawford,216591,4.772222536,Joan Crawford [Note 1] was an American film and television actress who started as a dancer and stage chorine,108French,Arts/Entertainment,Megan Fox,215982,4.770473036,Megan Denise Fox  is an American actress and model,50French,Arts/Entertainment,Solange Knowles,214068,4.764942316,"Solange Piaget Knowles  is an American singer, songwriter, model, and actress",77French,Arts/Entertainment,Taylor Lautner,210031,4.75311298,"Taylor Daniel Lautner  is an American actor, model and martial artist",69French,Arts/Entertainment,Frederic Remington,208765,4.749356438,"Frederic Sackrider Remington  was an American painter, illustrator, sculptor, and writer who specialized in depictions of the Old American West, specifically concentrating on the last quarter of the 19th-century American West and images of cowboys, American Indians, and the U",276French,Arts/Entertainment,Sylvester Stallone,208010,4.747105303,"Sylvester Gardenzio Stallone , nicknamed Sly Stallone, is an American actor, screenwriter and film director",107French,Arts/Entertainment,Buffalo Bill Cody,206990,4.744051024,"William Frederick ""Buffalo Bill"" Cody  was an American scout, bison hunter, and showman",87French,Arts/Entertainment,Zooey Deschanel,205543,4.739692219,"Zooey Claire Deschanel  is an American actress, singer-songwriter, and musician",79French,Sports,Ron Guidry,205457,4.739432196,"Ronald Ames Guidry , nicknamed ""Louisiana Lightning"" and ""Gator"", is a former Major League Baseball left-handed pitcher",119French,Sports,Randy Couture,204109,4.735342196,"Randy Duane Couture  is an American actor, retired mixed martial artist and former collegiate and Greco-Roman wrestler",118French,Arts/Entertainment,Anthony Bourdain,201491,4.727321104,"Anthony Michael Bourdain  is an American chef, author, and television personality",81French,Arts/Entertainment,Louise Bourgeois,200713,4.724917352,"Louise Joséphine Bourgeois , was a French-American artist and sculptor",70French,Arts/Entertainment,Julia Louis,197912,4.716185397,"Julia Scarlett Elizabeth Louis-Dreyfus  is an American actress, comedian, and producer",86French,Sports,Charlie Manuel,191749,4.696529304,,0French,Sports,Bruce Bochy,190082,4.691104014,Bruce Douglas Bochy  is the manager of the San Francisco Giants,63French,Arts/Entertainment,Paul Revere,189122,4.687958041,"Paul Revere  was an American silversmith, engraver, early industrialist, and a patriot in the American Revolution",113French,Arts/Entertainment,Ryan Phillippe,188040,4.684393067,"Matthew Ryan Phillippe , better known as Ryan Phillippe, is an American actor and director",90French,Other,Jean Lafitte,187336,4.682062496,Jean Lafitte  was a French-American pirate and privateer in the Gulf of Mexico in the early 19th century,104French,Arts/Entertainment,Katie Couric,185879,4.677211192,"Katherine Anne ""Katie"" Couric  is an American journalist and author",67French,Sports,Brett Bodine,182282,4.665069695,Brett Bodine  is a former NASCAR Winston Cup Series driver and is the current driver of the pace car in Sprint Cup events,121French,Sports,Lou Boudreau,181722,4.663157915,"Louis ""Lou"" Boudreau  was an American Major League Baseball player and manager",78French,Government,Eugene Debs,175406,4.641178341,"Eugene Victor ""Gene"" Debs  was an American union leader, one of the founding members of the Industrial Workers of the World , and five times the candidate of the Socialist Party of America for President of the United States",223French,Sports,Steve Prefontaine,174783,4.63896758,"Steve Roland ""Pre"" Prefontaine  was an American middle and long-distance runner who competed in the 1972 Olympics",113French,Sports,Paul Arizin,171806,4.628293498,"Paul Joseph Arizin , nicknamed ""Pitchin' Paul,"" was an American basketball player who spent his entire National Basketball Association  career with the Philadelphia Warriors from 1950 to 1962",191French,Sports,Tom Landry,170703,4.624291649,"Thomas Wade ""Tom"" Landry  was an American football player and coach",67French,Academia/Science,Pierre Charles L'Enfant,162732,4.594579084,"Pierre ""Peter"" Charles L'Enfant  was a French-born American architect and civil engineer best known for designing the layout of the streets of Washington, D",156French,Sports,Greg Biffle,162641,4.594231535,"Gregory Jack ""Greg"" Biffle  is a NASCAR driver who drives the No",64French,Arts/Entertainment,Sara Bareilles,162637,4.594216254,Sara Beth Bareilles  is an American singer-songwriter and musician,66French,Sports,Jake Delhomme,162191,4.592510024,Jake Christopher Delhomme  is a former American football quarterback,68French,Sports,Joakim Noah,161399,4.589468532,Joakim Simon Noah  is a professional basketball player who plays for the Chicago Bulls of the National Basketball Association ,126French,Sports,Laila Ali,161232,4.588825302,Laila Amaria Ali  is a retired undefeated American professional boxer,69French,Arts/Entertainment,Tila Tequila,160241,4.58499453,"Tila Nguyen , better known by her stage names Tila Tequila and Miss Tila, is an American model, television personality, singer, songwriter, actress, writer and blogger",167French,Arts/Entertainment,Gavin DeGraw,159573,4.582398944,Gavin Shane DeGraw  is an American musician and singer-songwriter,65French,Sports,Tom Glavine,159541,4.582274332,"Thomas Michael ""Tom"" Glavine  is an American retired professional baseball player",81French,Academia/Science,P. G. T. Beauregard,158864,4.579632135,"Pierre Gustave Toutant-Beauregard  was a Louisianan-born American military officer, politician, inventor, writer, civil servant, and the first prominent general of the Confederate States Army during the American Civil War",221French,Sports,Steve Largent,156174,4.569021151,"Steven Michael ""Steve"" Largent  is a retired American football player, enshrined in the Pro Football Hall of Fame, and a former Republican politician, having served in the U",173French,Sports,Dick Vermeil,155709,4.567168399,"Richard Albert ""Dick"" Vermeil  is a retired American head coach for the National Football League's Philadelphia Eagles , St",123French,Sports,Curly Lambeau,150261,4.545039494,"Earl Louis ""Curly"" Lambeau  was founder, player, and first coach of the Green Bay Packers professional football team",116French,Arts/Entertainment,Jessica Biel,149588,4.542250363,Jessica Claire Timberlake  is an American actress,49French,Military,Prince Achille Murat,148752,4.538768179,"Prince Achille Murat  was the eldest son of the Napoleonic King of Naples during the First French Empire, and later the mayor of Tallahassee, Florida in the United States",170French,Arts/Entertainment,Victoria Justice,148012,4.535669496,Victoria Dawn Justice  is an American actress and singer,56French,Arts/Entertainment,Teri Hatcher,147146,4.532023465,"Teri Lynn Hatcher  is an American actress, writer, presenter, and former NFL cheerleader",88French,Government,Earl Long,146651,4.529929767,Earl Kemp Long  was an American politician and the 45th Governor of Louisiana for three non-consecutive terms,109French,Academia/Science,Bill Nye,146201,4.528020263,"William Sanford ""Bill"" Nye , popularly known as Bill Nye the Science Guy, is an American science educator, comedian, television host, actor, writer, scientist, and former mechanical engineer, best known as the host of the Disney/PBS children's science show Bill Nye the Science Guy  and for his many subsequent appearances in popular media as a science educator",361French,Arts/Entertainment,Willem Dafoe,145978,4.527071819,"William J  ""Willem"" Dafoe  is an American actor",47French,Sports,Darrell Royal,144547,4.520950918,Darrell K Royal  was an American football player and coach,58French,Arts/Entertainment,Phil Anselmo,144120,4.519112743,"Philip Hansen ""Phil"" Anselmo  is an American musician who is best known as the former lead singer of the heavy metal band Pantera",129French,Sports,Zach Parise,142834,4.513543613,"Zachary Parise  is an American professional ice hockey left winger of French-Canadian heritage, an alternate captain for the Minnesota Wild in the National Hockey League ",170French,Arts/Entertainment,Channing Tatum,141779,4.508937278,"Channing Matthew Tatum  is an American actor, film producer, dancer, and model",78French,Arts/Entertainment,Earl W. Bascom,137883,4.491624397,"Earl W  Bascom  was an American painter, printmaker, rodeo performer and sculptor, raised in Canada, who portrayed his own experiences cowboying and rodeoing across the American and Canadian West",195French,Government,Michael Michaud,135923,4.482728775,"Michael Herman ""Mike"" Michaud  is an American politician from Maine",67French,Sports,Jeff Francoeur,134441,4.475917013,"Jeffrey Braden Francoeur , nicknamed ""Frenchy"", is an American professional baseball right fielder for the Philadelphia Phillies of Major League Baseball ",154French,Government,Izabel Goulart,134299,4.475260397,"Maria Izabel Goulart Dourado , better known as Izabel Goulart, is a Brazilian model",83French,Arts/Entertainment,Izzy Stradlin,134068,4.474190754,"Jeffrey Dean Isbell , known by his stage name Izzy Stradlin, is an American musician and songwriter",99French,Arts/Entertainment,Jean Baptiste Point du Sable,133675,4.47236673,"Jean Baptiste Point du Sable [n 1]  is regarded as the first permanent resident of what became Chicago, Illinois",112French,Academia/Science,William F. Durand,132977,4.469113855,William Frederick Durand  was a United States naval officer and pioneer mechanical engineer,91French,Government,Charlton Lyons,132815,4.468356449,"Charlton Havard Lyons, Sr",25French,Arts/Entertainment,Alice Guy,132696,4.467799494,Alice Guy-Blaché  was an early French filmmaker,47French,Sports,Jack LaLanne,132295,4.465919011,"Francois Henri ""Jack"" LaLanne  was an American fitness, exercise, and nutritional expert and motivational speaker who is sometimes called ""the godfather of fitness"" and the ""first fitness superhero",197French,Arts/Entertainment,Colbie Caillat,130632,4.458059082,"Colbie Marie Caillat  is an American pop singer-songwriter and acoustic guitarist from Malibu, California",105French,Sports,Andre Ethier,130467,4.457273784,"Andre Everett Ethier , is a Major League Baseball outfielder for the Los Angeles Dodgers",88French,Arts/Entertainment,Rose McGowan,129405,4.452195427,Rose Arianna McGowan  is an American actress and singer,55French,Arts/Entertainment,Jon Favreau,127872,4.444790819,"Jonathan Kolia ""Jon"" Favreau  is an American actor, director, screenwriter, voice artist, and comedian",102French,Sports,Melanie Oudin,127277,4.441892944,Melanie Oudin  is an American tennis player and former world junior no,70French,Military,Claire Lee Chennault,126871,4.439907784,"Lieutenant General Claire Lee Chennault  was an American military aviator best known for his leadership of the American ""Flying Tigers"" and the Republic of China Air Force in World War II",187French,Other,Felix Rohatyn,126641,4.438780365,Felix George Rohatyn  is an American investment banker,54French,Arts/Entertainment,Josh Duhamel,124752,4.429442605,"Joshua David ""Josh"" Duhamel  is an American actor and former fashion model",74French,Literature,Pierre Samuel du Pont de Nemours,124374,4.427557095,"Pierre Samuel du Pont de Nemours  was a French writer, economist, publisher and government official",99French,Arts/Entertainment,Danielle Lacourse,122559,4.418423093,"Miss USA 2007, the 56th Miss USA pageant, was held in Hollywood, California, on March 23, 2007, after two weeks of events and preliminary competition",149French,Other,Ervil LeBaron,122386,4.417545419,"Ervil Morrell LeBaron  was the leader of a polygamous Mormon fundamentalist group who ordered the killings of many of his opponents, using the religious doctrine of blood atonement to justify the murders",203French,Arts/Entertainment,Charles Boyer,121597,4.41352682,Charles Boyer  was a French actor who appeared in more than 80 films between 1920 and 1976,90French,Sports,Gus Frerotte,121407,4.412555201,"Gustave Joseph ""Gus"" Frerotte  is a former American football quarterback",72French,Arts/Entertainment,Lon Chaney,120454,4.407658708,"Leonidas Frank ""Lon"" Chaney  was an American stage and film actor, director and screenwriter",92French,Sports,Ray Guy,120253,4.406621029,William Ray Guy  is a retired American football punter for the Oakland/Los Angeles Raiders of the National Football League ,123French,Arts/Entertainment,Brandon Routh,120227,4.406486675,Brandon James Routh  is an American actor and former fashion model,66French,Government,John Sevier,119628,4.403383297,"John Sevier  was an American soldier, frontiersman and politician, and one of the founding fathers of the State of Tennessee",124French,Arts/Entertainment,Stephen Baldwin,118524,4.397622617,"Stephen Andrew Baldwin  is an American actor, director, producer and author",75French,Arts/Entertainment,Leslie Caron,117805,4.393841945,Leslie Claire Margaret Caron  is a French and American film actress and dancer who appeared in 45 films between 1951 and 2003,125French,Sports,Francis Ouimet,117679,4.393177032,"Francis DeSales Ouimet  was an American amateur golfer who is frequently referred to as the ""father of amateur golf"" in the United States",137French,Sports,Chad Gaudin,117385,4.391622795,Chad Edward Gaudin  is an American professional baseball pitcher in the Los Angeles Dodgers organization,104French,Government,Moon Landrieu,117353,4.391453392,"Maurice Edwin Landrieu, known as Moon Landrieu , is a Democratic politician from Louisiana who served as Mayor of New Orleans from 1970 to 1978",143French,Arts/Entertainment,Robert Goulet,117213,4.390711708,Robert Gerard Goulet  was an American singer and actor of French Canadian ancestry and Canadian upbringing and training after birth in Massachusetts,148French,Literature,Louis L'Amour,115126,4.379549046,Louis Dearborn L'Amour  was an American author,46French,Arts/Entertainment,Leelee Sobieski,115059,4.379187342,"Liliane Rudabet Gloria Elsveta Sobieski , known professionally as Leelee Sobieski, is an American film and television actress",125French,Arts/Entertainment,Lorraine Bracco,114306,4.37510767,Lorraine Bracco  is an American actress,39French,Other,Baroness Micaela Almonester de Pontalba,114115,4.37406858,"Micaela Leonarda Antonia Almonester y Rojas, Baroness de Pontalba  was a wealthy New Orleans-born aristocrat, businesswoman, and real estate developer, and one of the most dynamic personalities of that city's history",216French,Sports,Tyrann Mathieu,113632,4.371433154,Tyrann Devine Mathieu  is an American football free safety for the Arizona Cardinals of the National Football League ,117French,Arts/Entertainment,Maggie Quigley,112017,4.362539048,"Margaret Denise Quigley , professionally known as Maggie Q, is an American actress and model",92French,Arts/Entertainment,Wentworth Miller,111784,4.3612453,"Wentworth Earl Miller III  is an American actor, model, screenwriter and producer",81French,Government,Charles Joseph Bonaparte,111503,4.359681436,Charles Joseph Bonaparte  was an American lawyer and political activist for progressive and liberal causes,106French,Other,Frank Abagnale,111133,4.357616234,"Frank William Abagnale, Jr",26French,Sports,Cal Hubbard,110438,4.353718349,Robert Calvin Hubbard  was a professional American football player and Major League Baseball  umpire,100French,Government,Joel Roberts Poinsett,110251,4.352665377,Joel Roberts Poinsett  was an American physician and diplomat,61French,Arts/Entertainment,John Larroquette,109893,4.350644535,"John Bernard Larroquette  is an American film, television and stage actor",73French,Military,Francis Marion,109531,4.348594409,Francis Marion  was a military officer who served in the American Revolutionary War,83French,Arts/Entertainment,Julie Delpy,109140,4.34637242,"Julie Delpy  is a French-American actress, film director, screenwriter, and singer-songwriter",93French,Arts/Entertainment,Caprice Bourret,108078,4.340296838,"Caprice Bourret  is an American businesswoman, model, actress and television personality",88French,Arts/Entertainment,Nick Lachey,107190,4.335170683,"Nicholas Scott ""Nick"" Lachey  is an American singer-songwriter, actor, producer, and television personality",107French,Arts/Entertainment,Brad Dourif,106572,4.331578032,"Bradford Claude Dourif , known as Brad Dourif, is an American actor, voice artist, and comedian who gained early fame for his portrayal of Billy Bibbit in One Flew Over the Cuckoo's Nest, which brought him Golden Globe- and BAFTA Awards, as well as an Academy Award nomination",276French,Government,F. Edward Hebert,106240,4.329639388,"Felix Edward Hébert , known as F",32French,Arts/Entertainment,Tyrone Power,105716,4.32656724,,0French,Sports,Dick LeBeau,105703,4.326490829,"Charles Richard ""Dick"" LeBeau  is an American football coach and former cornerback",82French,Government,James Blanchard,105654,4.326202734,"James Johnston ""Jim"" Blanchard  is an American politician from Michigan",71French,Sports,Jerry Remy,104352,4.318498302,"Gerald Peter Remy, commonly known as Jerry Remy,  is a Major League Baseball broadcaster and former Major League Baseball second baseman",136French,Sports,Dick Jauron,103869,4.315615737,Richard Manuel Jauron  is a former National Football League  player and coach,77French,Media/Journalism,Adras LaBorde,103262,4.311974067,"Adras Paul LaBorde, I , was a reporter, managing editor, and columnist for the Alexandria Daily Town Talk, the largest newspaper in Central Louisiana",149French,Arts/Entertainment,Tom Sizemore,102625,4.308129321,"Thomas Edward ""Tom"" Sizemore, Jr",32French,Other,Simon Favre,102390,4.306704901,"Simon Favre  was an interpreter of the Muskogean languages, particularly Choctaw and Chickasaw, for the French, British, Spanish and Americans in the part of West Florida that became part of the states of Mississippi and Alabama",228French,Arts/Entertainment,Brooke Burke,102280,4.306037027,"Brooke Burke-Charvet , better known by her maiden name, Brooke Burke, is an American actress, dancer, model and television personality",134French,Arts/Entertainment,Raymond Loewy,102236,4.305769676,Raymond Loewy  was a French-born American industrial designer who achieved fame for the magnitude of his design efforts across a variety of industries,150French,Religion,Tammy Faye Messner,102190,4.30549005,"Tamara Faye LaValley Bakker Messner  was an American Christian singer, evangelist, entrepreneur, author, talk show host, and television personality",147French,Sports,Nicolas Rossolimo,101183,4.299336929,“’Nicolas Rossolimo’”  was an American-French-Greek-Russian chess Grandmaster,77French,Literature,Will Durant,100461,4.294887446,"William James Durant  was an American writer, historian, and philosopher",72French,Sports,Joe DeLamielleure,99378,4.288152902,Joseph Michael DeLamielleure  is a former American football offensive lineman who was an All-American at Michigan State,119French,Arts/Entertainment,Adrienne Barbeau,99239,4.287283232,Adrienne Jo Barbeau  is an American actress and the author of three books,73French,Sports,Tommy Mont,98962,4.285546511,"Thomas Allison ""Tommy"" Mont  was an American educator, university administrator, college football coach, and NFL player",119French,Arts/Entertainment,Charisma Carpenter,98604,4.283294726,Charisma Lee Carpenter  is an American actress,46French,Religion,Roy Bourgeois,98512,4.282714734,"Roy Bourgeois  is a laicized Roman Catholic priest; and an American activist and founder, in 1990, of the human rights group School of the Americas Watch ",154French,Arts/Entertainment,Richard Marquis,98461,4.282392984,"Richard ""Dick"" Marquis is an American studio glass artist who was born September 17, 1945 in Bumble Bee, Arizona",112French,Arts/Entertainment,Dorothy Lamour,97705,4.277603861,Dorothy Lamour  was an American actress and singer,50French,Sports,Surya Bonaly,97615,4.27703126,Surya Bonaly  is a French-American former figure skater,55French,Other,Alice Heine,97252,4.274716401,"Alice Heine , styled HSH The Princess of Monaco, and also The Duchess of Richelieu, was the American-born second wife of Prince Albert I of Monaco, a great-grandfather of Prince Rainier III of Monaco",199French,Other,Charles Guiteau,96706,4.271218223,"Charles Julius Guiteau  was an American preacher, writer, and lawyer who was convicted of the assassination of James A",118French,Arts/Entertainment,Ray Lamontagne,96101,4.267318895,"Raymond ""Ray"" Charles Jack LaMontagne  is an American singer-songwriter",71French,Arts/Entertainment,Melody Gardot,95632,4.264279182,"Melody Gardot /__r_do_/  is a Grammy-nominated American singer, writer and musician in Philadelphia, though she considers herself a ""citizen of the world""",154French,Government,Charlie Melancon,94449,4.256545124,"Charles Joseph ""Charlie"" Melançon  was the U",44French,Government,Dudley J. LeBlanc,93980,4.253452111,"Dudley Joseph LeBlanc, Sr",25French,Sports,Mike Fontenot,92951,4.246611511,"Michael Eugene ""Mike"" Fontenot  is a professional baseball infielder who is a free agent",88French,Arts/Entertainment,Brook Mahealani Lee,92917,4.246384195,"Brook Antoinette Mahealani Lee , known as Brook Lee, is an American beauty queen, actress, model and TV presenter who was crowned Miss Hawaii USA 1997, Miss USA 1997 and Miss Universe 1997",188French,Government,Nathaniel Macon,92896,4.246243753,Nathaniel Macon  was an American politician who served as a U,61French,Arts/Entertainment,Christopher Meloni,92728,4.245119067,Christopher Peter Meloni  is an American actor,46French,Sports,Damon Huard,92718,4.245052057,Damon Paul Huard  is a former American football quarterback,59French,Arts/Entertainment,Emeril Lagasse,92394,4.24287702,"Emeril John Lagasse  is an American celebrity chef, restaurateur, television personality, and cookbook author",109French,Arts/Entertainment,Susan La Flesche Picotte,91975,4.240052904,Suzanne LaFlesche Picotte  was an Omaha Indian doctor and reformer in the late 19th century,91French,Arts/Entertainment,Christopher Lambert,91504,4.236862899,"Christophe Guy Denis ""Christopher"" Lambert  is a French actor who has appeared in American, as well as French and other European productions",140French,Arts/Entertainment,Garry Trudeau,91494,4.236794993,"Garretson Beekman ""Garry"" Trudeau  is an American cartoonist, best known for the Pulitzer Prize-winning Doonesbury comic strip",126French,Arts/Entertainment,Daniel Baldwin,91219,4.234924659,"Daniel Leroy Baldwin  is an American actor, producer and director",65French,Sports,Brian St. Pierre,91218,4.234917847,Brian Fuller St  Pierre  is a former American football quarterback who is currently the head football coach of St,113French,Literature,Gerald Vizenor,90211,4.228020485,"Gerald Robert Vizenor  is an Anishinaabe writer and scholar, and an enrolled member of the Minnesota Chippewa Tribe, White Earth Reservation",140French,Arts/Entertainment,Tom Bergeron,89861,4.225605146,"Thomas ""Tom"" Bergeron  is an American television personality and game show host, best known as the host of America's Funniest Home Videos  and host of the ABC reality series Dancing with the Stars ",197French,Arts/Entertainment,William Baldwin,89609,4.223860269,"William Joseph Baldwin  is an American actor, producer, and writer known for his starring roles in such films as Flatliners , Backdraft , Sliver , Fair Game , Virus , Double Bang , as Johnny 13 in Danny Phantom , Art Heist , The Squid and the Whale , as himself in Forgetting Sarah Marshall , as Senator Patrick Darling in the drama series Dirty Sexy Money , Justice League: Crisis on Two Earths , as William van der Woodsen on Gossip Girl until December 2012, and as Gordon Flint on Parenthood",494French,Sports,Mark Gastineau,89576,4.22363141,Marcus Dell Gastineau  is a former American football player who was a leading defensive end for the New York Jets from 1979 to 1988,131French,Religion,Anton Docher,89361,4.222138292,"Anton Docher  was a French Franciscan Roman Catholic priest, missionary and defender of the Indians",99French,Arts/Entertainment,Madeleine Peyroux,89276,4.221546998,"Madeleine Peyroux  is an American jazz singer, songwriter, and guitarist",72French,Sports,Gene Lamont,89072,4.220125593,Gene William Lamont  is a former catcher and manager in Major League Baseball who managed the Chicago White Sox  and Pittsburgh Pirates ,136French,Arts/Entertainment,Justin Theroux,88737,4.217784345,"Justin Paul Theroux  is an American actor, director, and screenwriter",69French,Arts/Entertainment,Jorja Fox,88534,4.216361314,"Jorja-An Fox  is an American actress, musician and songwriter",61French,Arts/Entertainment,Lacey Chabert,88487,4.216031379,Lacey Nicole Chabert  is an American actress and voice actress,62French,Arts/Entertainment,Joan Blondell,88332,4.214942051,Rose Joan Blondell  was an American actress who performed in movies and on television for five decades as Joan Blondell,119French,Arts/Entertainment,Kevyn Aucoin,88274,4.21453394,"Kevyn James Aucoin  was an American make-up artist, photographer and author",75