Source Country,Field Of Influence,Name,Influence,log(influence),Description,UnknownGreece,Arts/Entertainment,Tatiana Troyanos,95759,4.265103772,"Tatiana Troyanos  was an American mezzo-soprano of Greek and German descent, remembered as ""one of the defining singers of her generation"" ",139Greece,Sports,Peter Angelos,95621,4.26420771,"Peter G  Angelos , is an American trial lawyer",46Greece,Sports,Kosta Koufos,94364,4.255985698,"Konstantine Demetrios ""Kosta"" Koufos  is a Greek-American professional basketball player for the Memphis Grizzlies of the National Basketball Association ",154Greece,Government,Nicole Malliotakis,94265,4.255333496,"Nicole Malliotakis  is a Republican politician from New York City who represents a small portion of Bay Ridge, Brooklyn and Staten Island in the New York State Assembly",168Greece,Sports,Zach Collaros,93488,4.250190781,Zach Collaros  is an American professional Canadian football quarterback for the Hamilton Tiger-Cats,100Greece,Arts/Entertainment,Amy Sedaris,92858,4.245989538,"Amy Louise Sedaris  is an American actress, author, and comedian",64Greece,Arts/Entertainment,Michael Symon,92814,4.245695053,"Michael D  Symon  is a James Beard Foundation Award-winning American chef, restaurateur, television personality, and author",123Greece,Sports,John Sitaras,91810,4.238937249,"John Sitaras is an American fitness professional, the creator of the Sitaras Method and the founder of Sitaras Fitness in New York City",135Greece,Government,Susan Bysiewicz,89718,4.224615599,Susan Bysiewicz  served as Secretary of the State of Connecticut from 1999 to 2011,82Greece,Media/Journalism,Jimmy Cefalo,89297,4.221693135,"James Carmen ""Jimmy"" Cefalo , is an American Journalist, news broadcaster and sports broadcaster, radio talk show host, Voice of the Miami Dolphins, businessman, wine enthusiast and former professional American football wide receiver and game show host",252Greece,Sports,Garo Yepremian,88947,4.219253024,"Garabed Sarkis ""Garo"" Yepremian  is an Armenian-American former football placekicker in the National Football League for the Detroit Lions, Miami Dolphins, New Orleans Saints, and Tampa Bay Buccaneers during a career that spanned from 1966 to 1981",247Greece,Sports,George Kontos,88930,4.21913426,George Nicholas Kontos  is an American professional baseball player,67Greece,Sports,Steve Billirakis,88357,4.215117878,Steve Billirakis  is an American professional poker player,58Greece,Media/Journalism,Chris Hondros,87994,4.21255997,Chris Hondros  was an American Pulitzer Prize-nominated war photographer,72Greece,Academia/Science,Nicholas A. Christakis,86989,4.205422722,"Nicholas A  Christakis  is an American sociologist and physician known for his research on social networks and on the socioeconomic and biosocial determinants of behavior, health, and longevity",193Greece,Literature,Jeffrey Eugenides,86360,4.200913652,Jeffrey Kent Eugenides  is an American novelist and short story writer,70Greece,Arts/Entertainment,Nick Verreos,86076,4.198866988,"Nick Verreos  is an American fashion designer, fashion commentator and former Project Runway contestant",103Greece,Sports,Milt Pappas,84797,4.189565317,"Milton Steven ""Milt"" Pappas  is a former professional baseball pitcher",70Greece,Business/Technology,Jason Calacanis,84698,4.188839488,Jason McCabe Calacanis  is an American Internet entrepreneur and blogger,72Greece,Government,Jen Psaki,84655,4.188523965,"Jennifer Rene ""Jen"" Psaki  is the current White House Communications Director",77Greece,Sports,Dixie Carter,84593,4.188068742,"Dixie Virginia Carter  was an American film, television, and stage actress",74Greece,Arts/Entertainment,Suzi Simpson,83821,4.182372376,The following is a list of Playboy Playmates of 1992,52Greece,Literature,Nick Mamatas,83304,4.178528173,"Nick Mamatas   is an American horror, science fiction and fantasy author and editor for the Haikasoru line of translated Japanese science fiction novels for Viz Media",166Greece,Arts/Entertainment,Johnny Otis,83203,4.177774393,"Johnny Otis  was an American singer, musician, composer, arranger, bandleader, talent scout, disc jockey, record producer, television show host, artist, author, journalist, minister, and impresario",197Greece,Business/Technology,George Logothetis,83201,4.177759458,George Michael Logothetis  is an international businessman,58Greece,Business/Technology,Alex Spanos,82963,4.175979556,Alexander Gus Spanos  is an American real estate developer and self-made billionaire who founded the A,102Greece,Arts/Entertainment,Ralph Macchio,82386,4.171643131,,0Greece,Sports,Dee Andros,82226,4.170435277,"Demosthenes Konstandies ""Dee"" Andrecopoulos  was an American football player, coach, and college athletics administrator",120Greece,Business/Technology,Ted Phillips,81230,4.16286312,Ted Phillips is an American businessman and the President and CEO of the National Football League's Chicago Bears and has been a part of the organization since 1984,164Greece,Arts/Entertainment,Jim Sclavunos,81129,4.162090082,"Jim Sclavunos  is an American drummer, multi-instrumentalist musician, record producer and writer",97Greece,Arts/Entertainment,Rita Wilson,79797,4.151804149,"Rita Wilson  is an American actress, singer, and producer",57Greece,Sports,Dean Karnazes,79770,4.15159388,"Dean Karnazes  , is an American ultramarathon runner, and author of Ultramarathon Man: Confessions of an All Night Runner, which details ultra endurance running for the general public",183Greece,Arts/Entertainment,Paul Avgerinos,78944,4.145126557,"Paul Avgerinos   is an American composer, performer and producer of new-age music whose recordings for Round Sky Music are also classified in the genres of ambient, space, world, World Fusion, electronic and drone",213Greece,Arts/Entertainment,Alexander Scourby,77860,4.136535733,"Alexander Scourby  was an American film, television, and voice actor known for his deep and resonant voice",106Greece,Arts/Entertainment,Cat Cora,77630,4.134697581,"Catherine Ann ""Cat"" Cora  is an American professional chef best known for her featured role as an ""Iron Chef"" on the Food Network television show Iron Chef America and as co-host of Around the World in 80 Plates on Bravo",220Greece,Arts/Entertainment,Gabrielle Carteris,77224,4.131439511,"Gabrielle Anne Carteris  is an American actress known for her role as Andrea Zuckerman on the early seasons of the 1990s television series Beverly Hills, 90210",159Greece,Government,Art Agnos,77190,4.131165891,"Arthur Christ ""Art"" Agnos  is an American politician",52Greece,Arts/Entertainment,Andrew Prokos,76828,4.128245146,Andrew Prokos  is an award-winning American architectural and fine-art photographer,83Greece,Arts/Entertainment,Natalie Fotopoulos,76205,4.123186188,List of the top twenty finalists from the second season of So You Think You Can Dance,85Greece,Literature,Harry Mark Petrakis,76036,4.121806722,Harry Mark Petrakis   is an American novelist and writer of short stories,73Greece,Government,Dean Alfange,75770,4.119629268,"Dean Alfange  was an American politician who held nominations and appointments from a number of parties, including the Democratic Party, the Republican Party, the American Labor Party, and the Liberal Party of New York, of which he was a founding member",253Greece,Arts/Entertainment,Angie Harmon,74319,4.107615262,"Angela Michelle ""Angie"" Harmon  is an American television and film actress and fashion model",92Greece,Media/Journalism,Spero Dedes,74103,4.105806791,Spero Dedes  is an American sportscaster,40Greece,Sports,Tom Pappas,73959,4.104598213,Tom Pappas  is an American track &amp; field decathlete,55Greece,Academia/Science,Menas Kafatos,73829,4.103505112,Menas C  Kafatos  is an American physicist of Greek descent and international writer on science,95Greece,Sports,Lonnie Paxton,73549,4.10114419,"Leonidas E  ""Lonie"" Paxton III  is an American football long snapper who is currently a free agent",98Greece,Arts/Entertainment,Jim Verraros,72890,4.09555193,"James Conrad ""Jim"" Verraros  is an American singer/actor and native of Crystal Lake, Illinois who is most notable for being one of the top 10 finalists in the first season of American Idol",188Greece,Academia/Science,C. L. Max Nikias,72420,4.091532545,"Chrysostomos L  ""Max"" Nikias  became the University of Southern California's eleventh president in August 2010",110Greece,Arts/Entertainment,Annette Artani,72313,4.090613848,Annet Artani  is a Greek singer and songwriter,46Greece,Literature,Byron Vazakas,71967,4.087633777,"Byron Vazakas  was an American poet, whose career extended from the modernist era well into the postmodernist period; nominee for the Pulitzer Prize for Poetry, 1947",165Greece,Arts/Entertainment,Art Alexakis,71629,4.084708743,"Arthur Paul ""Art"" Alexakis  is best known as the American singer, composer, and guitarist of the rock band Everclear",116Greece,Arts/Entertainment,Zoe Kazan,71338,4.082179366,"Zoe Swicord Kazan  is an American actress, screenwriter, and playwright, known for starring in the 2014 film In Your Eyes",121Greece,Arts/Entertainment,Marco Beltrami,71161,4.080635828,"Marco Edward Beltrami  is an American film composer best known for his work scoring horror films such as Mimic , The Faculty , Resident Evil , Don't Be Afraid of the Dark , The Woman in Black ",192Greece,Sports,George Parros,70333,4.073363842,"George James Parros  is a retired American ice hockey player, who played nine seasons in the National Hockey League",115Greece,Arts/Entertainment,George Stavrinos,69863,4.069197839,George Stavrinos  was an American illustrator,45Greece,Government,Michael Bilirakis,69740,4.068102959,"Michael Bilirakis , American politician, was a Republican member of the United States House of Representatives since 1983 until 2007, representing the 9th District of Florida",174Greece,Arts/Entertainment,Elizabeth Perkins,69442,4.065442298,Elizabeth Ann Perkins  is an American actress,45Greece,Sports,Fred Smerlas,68991,4.061393797,"Frederic Charles Smerlas  is a former American football defensive lineman who was a 5-time NFL Pro Bowl selection during 14-year career as a nose tackle with the Buffalo Bills, San Francisco 49ers, and New England Patriots",222Greece,Sports,Alex Grammas,68784,4.059526747,Alexander Peter Grammas  is a former Major League infielder and manager,71Greece,Academia/Science,Christos Papadimitriou,68512,4.057064864,"Christos Harilaos Papadimitriou  is a Greek engineer, computer scientist, and professor of Computer Science at the University of California, Berkeley",149Greece,Sports,Steve Lappas,67129,4.044394123,Steve Lappas  is an American college men's basketball coach,59Greece,Sports,Tony Pashos,66749,4.040866913,"Anthony ""Tony"" George Pashos  is an American football offensive tackle who is currently a free agent in the National Football League ",133Greece,Sports,Gus Triandos,66503,4.038572785,Gus Triandos  was a Greek American former professional baseball player,70Greece,Sports,Athanasios Polychronopoulos,66439,4.037974548,Athanasios Polychronopoulos  is a Greek professional poker player who won World Series of Poker bracelets at the 2011 and 2013 World Series of Poker,148Greece,Arts/Entertainment,Jessie Malakouti,65746,4.031459602,"Jessica Eden Malakouti , better known by her stage name Eden xo  is an Iranian",78Greece,Arts/Entertainment,Basil Poledouris,65634,4.030400239,Basil Poledouris  was a American music composer who concentrated on the scores for films and television shows,109Greece,Government,Theodore J. Sophocleus,65358,4.027781931,Theodore J  Sophocleus  is an American politician from Maryland and a member of the Democratic Party,100Greece,Government,Mike Haridopolos,65214,4.026411465,"Mike Haridopolos was a Republican member of the Florida State Senate, representing the 20th District, which included Brevard, Indian River, Osceola, and St",155Greece,Arts/Entertainment,Kristi Lauren Glakas,65107,4.025391171,Kristi Lauren Glakas Ingram  is an American beauty pageant contestant,69Greece,Other,George Lois,64896,4.023374267,"George Lois  is an American art director, designer, and author",62Greece,Business/Technology,George P. Mitchell,64533,4.019889033,"George Phydias Mitchell  was an American businessman, real estate developer and philanthropist from Texas credited with pioneering the economic extraction of shale gas",167Greece,Arts/Entertainment,Tracy Spiridakos,64308,4.017718909,Tracy Spiridakos is a Canadian actress,38Greece,Military,James Megellas,63908,4.013842095,"James Megellas  is a retired United States Army officer who commanded a platoon in Company ""H"" of the 3rd Battalion, 504th Parachute Infantry Regiment , 82nd Airborne Division during World War II",195Greece,Business/Technology,Bill Jemas,63886,4.013628167,"Bill Jemas is an American media entrepreneur, writer, and editor",64Greece,Arts/Entertainment,Alexander Frey,63445,4.009324269,"Alexander Frey is an American symphony orchestra conductor, virtuoso organist, pianist and harpsichordist",105Greece,Business/Technology,Alexander Pantages,62657,4.001558836,Alexander Pantages  was a Greek American vaudeville and early motion picture producer and impresario who created a large and powerful circuit of theatres across the western United States and Canada,197Greece,Sports,Gus Niarhos,62656,4.00154892,"Constantine Gregory ""Gus"" Niarhos  was an American professional baseball player",79Greece,Arts/Entertainment,Shuggie Otis,62652,4.001509252,"Shuggie Otis  is an American singer-songwriter, recording artist, and multi-instrumentalist",91Greece,Arts/Entertainment,Cristin Milioti,62474,3.999741471,Cristin Milioti  is an American actress,39Greece,Other,Dean Tavoularis,62301,3.998018513,"Dean Tavoularis  is a Greek American motion picture production designer whose work appeared in numerous box office hits such as The Godfather films, Apocalypse Now, The Brink's Job, One from the Heart and Bonnie and Clyde",221Greece,Arts/Entertainment,Nicholas Negroponte,62290,3.997908799,Nicholas Negroponte  is a Greek American architect,50Greece,Arts/Entertainment,Andy Milonakis,62135,3.996360767,"Andrew Michael ""Andy"" Milonakis  is an American actor, writer, rapper, and comedian",83Greece,Academia/Science,George Tchobanoglous,61558,3.99056395,"George Tchobanoglous  is an American civil and environmental engineer, writer and professor",91Greece,Arts/Entertainment,Greg Dulli,61541,3.990392337,Greg Dulli  is an American musician,35Greece,Academia/Science,Persi Diaconis,60889,3.983774446,Persi Warren Diaconis  is an American mathematician and former professional magician,84Greece,Sports,Aaron Miles,60353,3.978280678,Aaron Wade Miles  is a former Major League Baseball infielder,61Greece,Government,Frank Skartados,59846,3.973039059,"Frank Skartados  is the Assemblyman for the 104th district of the New York State Assembly which includes both the town and city of Newburgh, as well as Beacon, the city of Poughkeepsie, Marlboro, and Lloyd",205Greece,Government,Theodore C. Speliotis,59646,3.970959136,"Theodore C  ""Ted"" Speliotis  is a Democratic member of the Massachusetts House of Representatives, representing the 13th Essex District",135Greece,Business/Technology,P. Roy Vagelos,59531,3.969760019,"Pindaros Roy Vagelos, better known as P",39Greece,Arts/Entertainment,Thomas Chimes,59497,3.969405054,Thomas Chimes  was an influential painter and artist from Philadelphia,70Greece,Academia/Science,John Allen Paulos,59204,3.966337658,"John Allen Paulos  is an American professor of mathematics at Temple University in Philadelphia, Pennsylvania",109Greece,Arts/Entertainment,Dimitris Mitropoulos,59042,3.964635168,"Dimitri Mitropoulos  , was a Greek conductor, pianist, and composer",67Greece,Business/Technology,George Lycurgus,58872,3.962843574,George Lycurgus   was a Greek American businessman who played an influential role in the early tourist industry of Hawaii,121Greece,Academia/Science,Nicholas Metropolis,58773,3.961797848,Nicholas Constantine Metropolis  was an American physicist,58Greece,Sports,Chris Tsiprailidis,58750,3.96155465,"""Syracuse"" Christos Tsiprailidis  is a professional poker player, based in Syracuse, New York",93Greece,Sports,Tom Kostopoulos,58648,3.960474969,Thomas George Kostopoulos  is a Canadian professional ice hockey player,71Greece,Sports,Alex Karalexis,58647,3.960464375,Alex Karalexis  is an American professional mixed martial artist currently competing in the Lightweight division,112Greece,Government,Bruce Tarr,58526,3.959181118,Bruce E  Tarr  is the minority leader of the Massachusetts Senate,65Greece,Sports,Tom Anastos,58520,3.959117416,Tom Anastos  is the head coach of the Michigan State Spartans men's ice hockey team,83Greece,Arts/Entertainment,Penelope Spheeris,58258,3.95632939,"Penelope Spheeris  is an American film director, producer and screenwriter",74Greece,Sports,Chris Roupas,57916,3.952671134,"Chris Roupas  is a former 6 ft 5 in, 220 pound starting guard for the Greek professional basketball team Aiolos in Athens, Greece during the 1982-83 season",155Greece,Arts/Entertainment,Patricia Field,57768,3.951081327,"Patricia Field  is an American costume designer, stylist and fashion designer",77Greece,Arts/Entertainment,Elias Koteas,57608,3.949358028,"Elias Koteas  is a Canadian actor of film and television, best known for his roles in Fallen, The Killing, and as Casey Jones in the live-action first and third Teenage Mutant Ninja Turtles films",195Greece,Media/Journalism,Ernie Anastos,57210,3.945050475,Ernie Anastos  is an American New York City television news anchor,66Greece,Business/Technology,Lazaros Kalemis,57112,3.943985224,Lazaros Kalemis is a first generation Greek-American businessman and payments industry veteran,94Greece,Other,Harris Savides,56700,3.939486733,Harris Savides  was an American cinematographer,47Greece,Sports,Ted Karras,56524,3.937555075,"Theodore George ""Ted"" Karras, Jr",32Greece,Arts/Entertainment,Nick Cassavetes,56430,3.936520928,"Nicholas David Rowland ""Nick"" Cassavetes  is an American film actor, screenwriter, and filmmaker",96Greece,Military,George Dilboy,56181,3.933773192,"George Dilboy , , Private First Class, U",40Greece,Business/Technology,John Paul DeJoria,56060,3.932433547,John Paul Jones DeJoria  is an American billionaire businessman and philanthropist best known as a co-founder of the Paul Mitchell line of hair products and The Patrón Spirits Company,183Greece,Academia/Science,Chris Argyris,56055,3.932378128,"Chris Argyris  was an American business theorist, Professor Emeritus at Harvard Business School, and a Thought Leader at Monitor Group",134Greece,Military,Charles Moskos,55622,3.927559958,Charles C  Moskos  was a sociologist of the United States military and a professor at Northwestern University,109Greece,Sports,Chris Kontos,55316,3.924132296,,0Greece,Government,Zack Space,55105,3.921757715,"Zachary T  ""Zack"" Space  is an American politician and the former U",67Greece,Business/Technology,Peter Karmanos,54738,3.917605775,,0Greece,Sports,Mike Karakas,54702,3.917197002,Michael George Karakas  was an American professional ice hockey goaltender in the National Hockey League  who was the league's first American-born and trained goaltender,169Greece,Sports,Sam Mastrogiannis,54579,3.915798328,"Stamatis A  ""Sam"" Mastrogiannis  is a Greek American professional poker player who won two bracelets at the World Series of Poker",129Greece,Government,Michael N. Gianaris,54038,3.909608782,"Michael N  ""Mike"" Gianaris  is an American politician from Queens, New York",75Greece,Sports,Adam Burish,53905,3.908077648,Adam Mark Burish  is an American professional ice hockey winger who currently plays for the Chicago Wolves of the American Hockey League while under contract to the San Jose Sharks of the National Hockey League ,211Greece,Media/Journalism,Petros Papadakis,53902,3.908043067,Petros Papadakis  is an American television personality and radio co-host of the Petros and Money Show on Fox Sports Radio ,123Greece,Arts/Entertainment,Alexa Nikolas,53670,3.905363003,Alexa Helen Nikolas  is an American actress,43Greece,Arts/Entertainment,The Fiery Furnaces,53566,3.904157832,"The Fiery Furnaces are an American indie rock band, formed in 2000 in Brooklyn, New York",88Greece,Arts/Entertainment,John Aniston,53394,3.902159521,John Anthony Aniston  is a Greek-American actor,47Greece,Sports,Niko Koutouvides,53349,3.901635644,Niko Stelios Koutouvides  is a former American football linebacker,66Greece,Literature,Chloe Aridjis,53060,3.898260625,Chloe Aridjis is a London-based Mexican novelist and writer,59Greece,Academia/Science,Kyriacos Costa Nicolaou,52995,3.897499005,Kyriacos Costa Nicolaou  is a Cypriot-American chemist known for his research in the area of natural products total synthesis,125Greece,Arts/Entertainment,John Varvatos,52864,3.895961206,John Varvatos is an American contemporary menswear designer,59Greece,Academia/Science,Symeon C. Symeonides,52823,3.895479128,,0Greece,Academia/Science,Panayiotis Zavos,52701,3.894042433,"Panayiotis Michael Zavos , or Panos Zavos , is a biologist from Cyprus",70Greece,Sports,John Korfas,52473,3.891348524,Jon Anthony Korfas  is a retired Greek American professional basketball player and a professional basketball coach,114Greece,Arts/Entertainment,Zenos Frudakis,52332,3.88967669,Zenos Frudakis  is a figurative sculptor whose subjects include portraits of living and historical individuals and poetic/philosophical sculpture,145Greece,Other,Dino Stamatopoulos,52030,3.886080674,"Konstantinos ""Dino"" Stamatopoulos  is an American television comedy writer, actor and producer who worked on TV programs such as Mr",131Greece,Other,Anna Louizos,51890,3.884406561,Anna Louizos  is an American scenic designer and art director,61Greece,Other,Phedon Papamichael,51797,3.883291972,"Phedon Papamichael ASC , born 1962, is a Greek cinematographer and film director",80Greece,Arts/Entertainment,Hermes Pan,51707,3.882211431,"Hermes Pan  was an American dancer and choreographer, principally remembered as Fred Astaire's choreographic collaborator on the famous 1930s movie musicals starring Astaire and Ginger Rogers",191Greece,Arts/Entertainment,Andrew Moskos,51607,3.881008622,"Boom Chicago is a creative group, based in Amsterdam, the Netherlands, that writes and performs sketch and improvisational comedy at the Rozentheater",149Greece,Military,James G. Kalergis,50814,3.871386993,James George Kalergis was a career U,36Greece,Business/Technology,John Rigas,50798,3.87119132,"John James Rigas  is one of the founders of Adelphia Communications Corporation, which at its peak was one of the largest cable TV companies in the United States",161Greece,Arts/Entertainment,Nick Gravenites,50778,3.870946642,"Nicholas George Gravenites , with stage names like Nick ""The Greek"" Gravenites and Gravy, is a blues, rock and folk singer",122Greece,Sports,Jimmy Carson,50710,3.870114016,James Charles Carson  is a retired American professional hockey player,70Greece,Arts/Entertainment,Milton Katselas,50695,3.869930198,"Milton George Katsalas  was an American director and producer of stage and film, as well as a famous Hollywood acting instructor and coach who trained under Elia Kazan and Lee Strasberg at the acclaimed Actors Studio in New York City",233Greece,Government,James C. Condos,50621,3.869022567,"James C  ""Jim"" Condos  is the current Vermont Secretary of State and former Democratic member of the Vermont State Senate, representing the Chittenden senate district",166Greece,Arts/Entertainment,Greg Yaitanes,50605,3.868826148,Greg Yaitanes  is an American television and film director,58Greece,Sports,June Peppas,50213,3.863994381,June Peppas  is a former first basewoman and pitcher who played from 1948 through 1954 in the All-American Girls Professional Baseball League,141Greece,Government,Helen Boosalis,49997,3.861315835,Helen G  Boosalis  was a Nebraska Democratic Party politician,61Greece,Media/Journalism,Ted Sarandis,49671,3.857251222,"Theodore A  ""Ted"" Sarandis is an American sports radio personality in Boston who was the host of the Ted Nation show that was broadcast from 7 PM to midnight weekdays on Boston sports radio station WEEI from 1992 until September 2005 and the play by play announcer for Boston College Basketball from 1995 to 2010",312Greece,Arts/Entertainment,Constantino Brumidi,49478,3.854832281,"Constantino Brumidi  was an Italian-American historical painter, best known and honored for his fresco work in the Capitol Building in Washington, DC",149Greece,Business/Technology,Michael Capellas,49463,3.854643886,Michael David Capellas  is an American executive in the computer and telecommunication industries,97Greece,Business/Technology,Ed Zander,48894,3.8474549,Edward J  Zander  is an American business executive,51Greece,Military,George Colvocoresses,48751,3.845635023,"George Musalas ""Colvos"" Colvocoresses  was a United States Navy officer who commanded the Saratoga during the American Civil War",128Greece,Arts/Entertainment,Dimitri Logothetis,48633,3.844129281,"Dimitri Logothetis is an award winning US actor, director and producer",70Greece,Sports,Lou Tsioropoulos,48593,3.843618031,"Louis C  ""Lou"" Tsioropoulos  is a retired Greek-American professional basketball player who played for the NBA's Boston Celtics for three seasons from 1956-1959",160Greece,Sports,Joe Panos,48539,3.842927176,Joe Panos  is a former American football offensive lineman in the National Football League for the Philadelphia Eagles and Buffalo Bills,136Greece,Sports,Al Campanis,48478,3.84214584,Alexander Sebastian Campanis  was an American executive in Major League Baseball,80