Source Country,Field Of Influence,Name,Influence,log(influence),Description,UnknownChina,Sports,Jeremy Lin,568801,5.372133751,Jeremy Shu-How Lin  is an American professional basketball player for the Los Angeles Lakers of the National Basketball Association ,132China,Other,Charles K. Kao,325584,5.025484688,"The Honourable Sir Charles Kuen Kao, GBM, KBE, FRS, FREng  is a Chinese-born Hong Kong, American and British electrical engineer and physicist who pioneered in the development and use of fiber optics in telecommunications",221China,Sports,Brian Ching,307689,4.990360028,Brian Ching  is the managing director of the Houston Dash,57China,Sports,Michelle Kwan,266097,4.900124407,Michelle Wingshan Kwan  is an American figure skater,52China,Arts/Entertainment,Maya Lin,258551,4.882249883,Maya Ying Lin  is an American designer and artist who is known for her work in sculpture and landscape art,106China,Arts/Entertainment,Bruce Lee,256813,4.87805912,"Bruce Lee  was a Hong Kong American martial artist, Hong Kong action film actor, martial arts instructor, philosopher, filmmaker, and the founder of Jeet Kune Do",161China,Arts/Entertainment,I. M. Pei,246756,4.853237908,"Ieoh Ming Pei , commonly known as I",35China,Arts/Entertainment,Ang Lee,239827,4.835540944,"Ang Lee OBS  is a Taiwanese-born American film director, screenwriter and producer",82China,Sports,Michael Chang,233276,4.818332745,Michael Te-Pei Chang  is an American tennis player,50China,Government,Leland Yee,220746,4.784029103,"Leland Yin Yee  is a former Democratic California State Senator for District 8, which when he was elected, covered parts of San Francisco and the Peninsula",155China,Arts/Entertainment,Nancy Kwan,216011,4.770556457,"Nancy ""Ka Shen"" Kwan  is a Hong Kong-born, biracial American actress, who played a pivotal role in the acceptance of actors of Asian ancestry in major Hollywood film roles",171China,Sports,Vania King,215148,4.768069148,Vania King   is an American tennis player,41China,Government,Steven Chu,196146,4.710616243,Steven Chu  is an American physicist who served as the 12th United States Secretary of Energy from 2009 to 2013,111China,Sports,Nathan Adrian,193968,4.703678366,Nathan Ghar-jun Adrian  is an American competition swimmer and three-time Olympic gold medalist who currently holds the American record in the 50- and 100-yard freestyle events,176China,Arts/Entertainment,Wilber Pan,188187,4.684878605,"Wilber Pan, also known as Will Pan , was born on 6 August 1980",62China,Arts/Entertainment,Lucy Liu,188061,4.684462453,"Lucy Alexis Liu /_lu_/  is an American actress, model, artist, and occasional producer and director",99China,Government,Elaine Chao,182851,4.667006194,Elaine Lan Chao  is a Chinese-American politician who served as the 24th U,74China,Arts/Entertainment,Anna May Wong,174120,4.636606204,"Anna May Wong  was the first Chinese American movie star, and the first Asian American actress to gain international recognition",128China,Arts/Entertainment,Joan Chen,173620,4.634819423,"Joan Chen  is a Chinese-American actress, film director, screenwriter, and film producer",88China,Other,Chen Ning Yang,171773,4.628174143,"Chen-Ning Franklin Yang , also known as Yang Zhenning, is a Chinese-born American physicist who works on statistical mechanics and particle physics",147China,Other,Shiing-Shen Chern,171600,4.627548054,Shiing-Shen Chern  was a Chinese-born American mathematician,60China,Arts/Entertainment,Leehom Wang,169116,4.618488173,"Wang Leehom , sometimes credited as Leehom Wang, is a Chinese-American singer-songwriter, record producer, actor and film director",130China,Other,Yuan T. Lee,166141,4.607460692,Yuan Tseh Lee  is a Taiwanese chemist,37China,Government,Judy Chu,163535,4.597637517,,0China,Arts/Entertainment,Malan Breton,162218,4.592613449,Malan Breton  is a Taiwanese-born fashion designer based in New York City,73China,Other,Roger Y. Tsien,157814,4.575511836,Roger Yonchien Tsien  is an American biochemist,47China,Arts/Entertainment,Kelis,152716,4.555108975,"Kelis Rogers Mora  , better known mononymously as Kelis, is an American singer-songwriter and certified chef",108China,Government,Gary Locke,146524,4.529391457,Gary Faye Locke  is an American politician,42China,Arts/Entertainment,Charles Mingus,135424,4.480443535,,0China,Government,Grace Meng,132462,4.466702847,"Grace Meng  is an American lawyer and a Democratic member of the United States House of Representatives, representing New York's 6th congressional district in the New York City borough of Queens, which includes neighborhoods like Bayside, Flushing, Forest Hills, Rego Park, Fresh Meadows, Glendale, Kew Gardens and Maspeth",322China,Sports,Johnny Chan,131891,4.464018687,Johnny Chan  is a Chinese-born American professional poker player,65China,Arts/Entertainment,Olivia Munn,131077,4.460172073,"Lisa Olivia Munn  is an American actress, model, television personality and author",82China,Arts/Entertainment,Jennifer Tilly,130522,4.45753566,Jennifer Tilly  is an American actress and poker player,55China,Arts/Entertainment,Kelly Hu,129305,4.451715094,"Kelly Ann Hu  is an American actress, voice artist and former fashion model",75China,Arts/Entertainment,Jason Tom,127600,4.443467753,"Jason Tom  is an Asian American musician, dancer, composer, poet, teacher, and motivational speaker of Hawaiian-Chinese descent known for beatboxing in music, dance, poetry slam, and the performing arts",202China,Government,Tony Hwang,126516,4.438166779,Tony Hwang  is a residential real estate agent for Coldwell Banker and serves as the State Representative for the 134th District  in the Connecticut General Assembly,165China,Arts/Entertainment,Sam Tsui,123818,4.42477326,"Samuel ""Sam"" Tsui  is an American musician and internet celebrity who gained moderate fame on YouTube",101China,Arts/Entertainment,Justin Lin,122795,4.419618387,Justin Lin  is a Taiwanese-born American film director whose films have grossed $2 billion worldwide,100China,Sports,Norm Chow,119165,4.400973859,"Norman Yew Heen ""Norm"" Chow  is an American football coach and former player",76China,Business/Technology,Andrea Jung,117394,4.391670432,"Andrea Jung   is a Canadian-American executive, non-profit leader, and prominent women's-issues supporter",105China,Arts/Entertainment,Kevin Wu,116965,4.389395691,Kevin Wu   is an American comedian and was a YouTube celebrity who was best known by his YouTube username of KevJumba,117China,Other,Paul C. W. Chu,116948,4.389305378,"Paul Chu  is a Chinese-born American physicist specializing in superconductivity, magnetism, and dielectrics",108China,Arts/Entertainment,Daniel Wu,116303,4.385869062,"Daniel Yin-Cho Wu   is a Hong Kong American actor, director and producer",72China,Government,Wenjian Liu,116159,4.385099283,"On December 20, 2014, Ismaaiyl Abdullah Brinsley, 28, killed two New York City Police Department  officers in the line of duty in the Bedford",141China,Literature,Tao Lin,112391,4.364610093,"Tao Lin  is an American novelist, poet, essayist, short-story writer, and artist",80China,Government,Daniel Akaka,112312,4.364173201,Daniel Kahikina Akaka____  is a Native Hawaiian-Chinese American politician who was a United States Senator from Hawaii from 1990 to 2013,137China,Government,Goodwin Liu,111020,4.35698414,"Goodwin Hon Liu  is an American lawyer, educator and an Associate Justice of the Supreme Court of California",108China,Other,T. Y. Lin,110969,4.356698647,Tung-Yen Lin  was a structural engineer who was the pioneer of standardizing the use of prestressed concrete,108China,Sports,Christina Gao,110162,4.352163602,Christina Gao  is an American figure skater,43China,Other,Alfred Y. Cho,108236,4.341204508,Alfred Yi Cho  is the Adjunct Vice President of Semiconductor Research at Alcatel-Lucent's Bell Labs,100China,Arts/Entertainment,Shen Wei,106723,4.332457768,"Shen Wei  is a Chinese-born American choreographer, visual artist and director who resides in New York City",107China,Arts/Entertainment,Ted Fu,106525,4.331303953,"Wong Fu Productions[Note 1] is an American filmmaking group composed of Wesley Chan , Ted Fu , and Philip Wang ",111China,Sports,Jerry Hsu,106317,4.330089553,Jerry Hsu  is an American professional skateboarder and photographer,68China,Government,Charles Djou,105974,4.328081761,Charles Kong Djou  is an American politician who served as U,60China,Literature,David Henry Hwang,105012,4.322415713,"David Henry Hwang  is an American playwright, librettist, and screenwriter, as well as a theater professor",106China,Sports,Tony Gunawan,104906,4.321788216,"Tony Gunawan   is a Chinese descended, Indonesian born badminton player and coach who excelled internationally for Indonesia and later for the United States",156China,Government,Denny Chin,104231,4.317777424,Denny Chin  is a judge on the United States Court of Appeals for the Second Circuit,83China,Arts/Entertainment,Haing S. Ngor,104168,4.317401759,"Haing Somnang Ngor  was a Cambodian American physician, actor, and author who is best known for winning the 1985 Academy Award for Best Supporting Actor for his debut performance in the movie The Killing Fields, in which he portrayed Cambodian journalist and refugee Dith Pran",276China,Business/Technology,Charles Wang,104052,4.316709463,"Charles B  Wang  is a businessman and philanthropist who was a co-founder and former CEO of Computer Associates International, Inc",130China,Government,Chris Lu,102699,4.308577187,,0China,Government,Ed Jew,102141,4.305192049,"Edmund ""Ed"" Jew  is an incarcerated former Chinese American politician based in San Francisco",93China,Arts/Entertainment,James Wong Howe,101677,4.302363056,,0China,Other,Chien,101024,4.298359789,"The jian  is a double-edged straight sword used during the last 2,500 years in China",84China,Other,Leroy Chiao,100155,4.292991998,"Leroy Chiao  is an American engineer, former NASA astronaut, entrepreneur, motivational speaker and engineering consultant",122China,Government,Tina Tchen,99898,4.291395589,,0China,Other,Samuel C. C. Ting,99573,4.289370894,"Samuel Chao Chung Ting   is an American physicist who received the Nobel Prize in 1976, with Burton Richter, for discovering the subatomic J/_ particle",151China,Other,Tim Wu,99195,4.287007687,Tim Wu is an American academic who ran unsuccessfully in the 2014 Democratic primary for lieutenant governor of the state of New York,133China,Arts/Entertainment,Fala Chen,96094,4.267273636,Fala Chen  is a Chinese-born American actress and singer,56China,Other,Vincent Chin,95338,4.262366079,"Vincent Jen Chin  was a Chinese American man who was severely beaten in the Detroit suburb of Highland Park, Michigan in June of 1982",133China,Sports,Chau Giang,93614,4.251027632,"Chau Tu Giang  is a Vietnamese-born American professional poker player of Chinese descent, who is a three-time World Series of Poker bracelet winner and a three-time final tablist of the World Poker Tour with over $3 million in live tournament winnings alone",258China,Sports,John Juanda,93305,4.248973345,"Johnson ""John"" Juanda  is an Indonesian-born American professional poker player based in Marina del Rey, California",115China,Arts/Entertainment,Carmit Bachar,93261,4.248680272,"Carmit Bachar  is an American singer, dancer, model, actress and showgirl",73China,Sports,Amy Chow,93207,4.248320402,"Amy Yuen Yee Chow  is a retired American gymnast and a member of the famous Magnificent Seven, the first American team to win Olympic gymnastics gold",149China,Government,Hiram L. Fong,93160,4.248007012,"Hiram Leong Fong , born Yau Leong Fong , was an American businessman and politician from Hawaii",95China,Business/Technology,David T. Hon,92646,4.244569373,,0China,Arts/Entertainment,Brandon Lee,92339,4.242507044,Brandon Bruce Lee  was an American actor and martial artist,59China,Arts/Entertainment,Meg Tilly,92309,4.242305146,Meg Tilly  is a Canadian-American actress and novelist,54China,Arts/Entertainment,Keye Luke,91828,4.239059054,Keye Luke  was a Chinese-born American actor,44China,Arts/Entertainment,Julie Chen,91495,4.236801784,"Julie Suzanne Chen Moonves  is an American television personality, news anchor, and producer for CBS",100China,Literature,Gene Luen Yang,89900,4.225874749,Gene Luen Yang  is a Chinese American writer of graphic novels and comics,73China,Arts/Entertainment,Rosalind Chao,89646,4.224116769,Rosalind Chao ) is an American actress,38China,Other,Alice S. Huang,88883,4.218805795,Alice S  Huang  is an American biologist specialized in microbiology and virology,81China,Government,David Wu,88767,4.217994369,David Wu  is an American politician who served as the U,55China,Arts/Entertainment,Lisa Ling,87325,4.207818041,Lisa J  Ling  is an American journalist and writer,50China,Arts/Entertainment,B. D. Wong,87294,4.207597431,"Bradley Darryl ""BD"" Wong  is an American actor",46China,Arts/Entertainment,Leah Dizon,86651,4.203003793,"Leah Dizon  is a former gaijin tarento, singer, and model",57China,Military,Danny Chen,86262,4.20020817,Danny Chen  was a Chinese-American U,36China,Literature,Eileen Chang,84885,4.190209787,"Eileen Chang , also known as Zhang Ailing or Chang Ai-ling, was one of the most influential modern Chinese writers",114China,Government,John Liu,84875,4.190136585,"John Chun Liu  is a New York City politician, who previously served as the 43rd New York City Comptroller from January 1, 2010 ",127China,Arts/Entertainment,Richard On,84035,4.183956659,,0China,Arts/Entertainment,Lauren Tom,83879,4.18280216,"Lauren Tom  is an Chinese-American stage, film, television and voice actress",76China,Other,Henry T. Yang,83492,4.179928819,"Henry Tzu-Yow Yang  is an engineer and educator currently serving as the fifth chancellor of the University of California, Santa Barbara, a post he's held since 1994",165China,Arts/Entertainment,Vera Wang,83014,4.176361393,Vera Ellen Wang  is an American fashion designer based in New York City and former figure skater,96China,Arts/Entertainment,Jaycee Chan,82942,4.17582226,Jaycee Chan Jo-ming  is an American-born Hong Kong actor and singer,67China,Arts/Entertainment,Connie Chung,82750,4.174382283,"Constance Yu-Hwa Chung Povich  better known as Connie Chung, is an American journalist",86China,Sports,Julie Chu,82428,4.171959804,Julie Wu Chu  is an American Olympic ice hockey player who plays the position of forward on the United States women's ice hockey team and the position of defense on the Montreal Stars,183China,Other,Chang and Eng Bunker,82331,4.171228196,"Chang  and Eng  Bunker  were Thai-American conjoined twin brothers whose condition and birthplace became the basis for the term ""Siamese twins""",143China,Arts/Entertainment,Kevin Cheng,82080,4.169331058,Kevin Cheng Ka-wing  is a Hong Kong American actor and singer who is currently under the management of the Hong Kong television network TVB,139China,Arts/Entertainment,Anna Chen Chennault,81539,4.165222202,"Anna Chennault, born Chen Xiangmei , also known as Anna Chan Chennault or Anna Chen Chennault, is the widow of World War II leader Lieutenant General Claire Lee Chennault, commander of American air operations in China",217China,Arts/Entertainment,Janel Parrish,81355,4.163818521,"Janel Parrish  is an American actress, dancer, singer and songwriter",68China,Literature,Amy Tan,80795,4.159526828,Amy Tan  is an American writer whose works explore mother-daughter relationships and the Chinese-American experience,116China,Arts/Entertainment,CoCo Lee,80770,4.159334542,"Coco Lee  is a Hong Kong-born American singer-songwriter, record producer, dancer, and actress",94China,Military,Francis B. Wai,78781,4.143842327,Francis Brown Wai  was a captain in the United States Army and received the Medal of Honor for actions during the recapture of the Philippines from Japan in 1944,161China,Arts/Entertainment,Melissa Lee,77746,4.135625329,Melissa Ji-Yun Lee   is a New Zealand politician,48China,Arts/Entertainment,William Hung,77195,4.131206137,"William James Hung , also known as Hung Hing Cheong, is a Hong Kong-born American singer who gained fame in early 2004 as a result of his off-key audition performance of Ricky Martin's hit song ""She Bangs"" on the third season of the television series American Idol",264China,Other,Chang Yi Wang,77169,4.13099683,"Chang Yi Wang , is an immunologist and astute organic chemist, best known for establishing a new platform in vaccines technology that employs designer peptide as key ingredients to be formulated into vaccines for the prevention and treatment of AIDS, HIV, Alzheimer disease, allergy and other emerging infectious diseases in both humans and animals",348China,Arts/Entertainment,George Hu,76845,4.128382616,"George Hu  born on July 24, 1982 in New York City, New York",59China,Arts/Entertainment,Timothy Tau,76732,4.127468275,Timothy Tau is an American writer and filmmaker,47China,Arts/Entertainment,Vanness Wu,76535,4.125871023,"Vanness Wu  is an American actor, singer, director, and producer",64China,Arts/Entertainment,Iris Chang,76523,4.125773595,Iris Shun-Ru Chang  was an American journalist,46China,Government,Jay Chen,76383,4.124635812,"Jay F  Chen  is a Taiwanese-American Democratic politician, known as a member and president of the Board of Education of the Hacienda La Puente Unified School District in Southern California, and as a candidate for election in 2012 in California's 39th Congressional District",275China,Other,Crystal Lee,76278,4.123781106,"Crystal Lee is an American beauty queen who was Miss California 2013, the first runner-up in the Miss America 2014 pageant, Miss Chinatown USA 2010, and Miss California Outstanding Teen 2008",190China,Business/Technology,Oscar Tang,75573,4.11801171,"Oscar L  Tang  is a Chinese-born American financier who is notable as the first leading Chinese-American philanthropist for education and arts and culture, for which he was elected as a fellow of the American Academy of Arts and Sciences in 2005",245China,Business/Technology,Wendi Deng,75237,4.115243075,Wendi Deng Murdoch  is a Chinese-born American businesswoman,60China,Arts/Entertainment,Ming-Na Wen,75228,4.115168746,"Ming-Na Wen ; born November 20, 1963) is a Macau-born American actress",70China,Arts/Entertainment,Carrie Ann Inaba,74749,4.111199864,"Carrie Ann Inaba  is an American dancer, choreographer, television dance competition judge, actress, game show host, and singer",127China,Other,Ching W. Tang,74670,4.110542847,Ching W  Tang  is an American physical chemist,46China,Arts/Entertainment,Xu Bing,74427,4.108517527,Xu Bing  is a Chinese-born artist who lived in the United States for eighteen years,83China,Government,Margaret Chin,74006,4.104992938,Margaret Chin  is a New York City-based American politician,59China,Arts/Entertainment,Annabel Chong,73810,4.10334519,Annabel Chong  is the former stage name of a Singaporean-born American pornographic film actress who became famous after starring an adult film that was promoted as The World's Biggest Gang Bang,194China,Arts/Entertainment,Victor Sen Yung,73357,4.099520072,Victor Sen Yung  was an American character actor,48China,Arts/Entertainment,Only Won,73060,4.096999371,"Only Won  is an American rapper, actor, and stunt performer",59China,Arts/Entertainment,Eddie Huang,72836,4.095091448,"Edwyn Charles Huang , known as Eddie Huang, is an American restaurateur, chef, food personality, writer, and attorney",117China,Business/Technology,Tony Hsieh,72780,4.094613551,Tony Hsieh  is an American internet entrepreneur and venture capitalist,71China,Arts/Entertainment,Laura Ling,72331,4.09076849,Laura G  Ling  is an American journalist and writer,51China,Other,Harry Wu,72068,4.088505161,Harry Wu  is Chinese human rights activist,42China,Government,Amy Chua,71434,4.083014939,"Amy L  Chua , is an American lawyer, writer, and legal scholar",62China,Business/Technology,Fred Chang,71233,4.081264171,,0China,Other,Leon Chua,70745,4.076992908,"Leon Ong Chua  is an IEEE Fellow and a professor in the electrical engineering and computer sciences department at the University of California, Berkeley, which he joined in 1971",178China,Arts/Entertainment,Martin Yan,70242,4.07255941,Martin Yan  is a Chinese-born Hong Kong-American chef and food writer,69China,Sports,Ivana Hong,69082,4.062212806,Ivana Hong  is an American artistic gymnast,43China,Other,Andrew Yao,68851,4.060131672,Andrew Chi-Chih Yao  is a Chinese American computer scientist and computational theorist,88China,Other,Daniel Chee Tsui,68445,4.056456944,Daniel Chee Tsui  is a Chinese-born American physicist whose areas of research included electrical properties of thin films and microstructures of semiconductors and solid-state physics,185China,Arts/Entertainment,Ken Hom,68145,4.053727597,"Ken Hom OBE  is an American-born Chinese chef, author and television-show presenter for the BBC",95China,Arts/Entertainment,Vienna Teng,67887,4.051370731,"Cynthia Yih Shih , better known by her stage name Vienna Teng, is a Taiwanese American pianist and singer-songwriter based in Detroit, Michigan",143China,Other,Yitang Zhang,67511,4.04791983,"Yitang ""Tom"" Zhang  is a Chinese-born American mathematician working in the area of number theory",97China,Business/Technology,Greg Tseng,67507,4.047883015,"Greg Yuchang Tseng  is an American Internet entrepreneur who was born in Taipei, Taiwan, and raised in Washington, Virginia",123China,Other,Frank H. Wu,67112,4.044236754,"Frank H  Wu  is a law professor, author, and public intellectual",64China,Other,Ann Lee,66702,4.040429258,"Mother Ann Lee  was the leader of the United Society of Believers in Christ's Second Appearing, or Shakers",106China,Government,Lanhee Chen,66477,4.038329821,"Lanhee J  Chen  is the David and Diane Steffy Research Fellow at the Hoover Institution, Director of Domestic Policy Studies and Lecturer in the Public Policy Program at Stanford University, and Lecturer in Law at Stanford Law School",233China,Arts/Entertainment,Jennifer 8. Lee,65267,4.026916224,Jennifer 8  Lee   is an American journalist who previously worked for The New York Times,88China,Government,Shien Biau Woo,64844,4.022876203,,0China,Other,Andrew Lih,64335,4.017979724,"Andrew Lih  is a Chinese American new media researcher, consultant and writer, as well as an authority on both Wikipedia and internet censorship in the People's Republic of China",178China,Business/Technology,Alfred Lin,64075,4.015463607,Alfred Lin is an American venture capitalist at Sequoia Capital,63China,Arts/Entertainment,Malese Jow,63909,4.013851817,Malese Jow  is an American actress and singer-songwriter,56China,Business/Technology,Kim Ng,63546,4.010312604,Kim Ng  is an American executive in Major League Baseball,57China,Arts/Entertainment,Jason Wu,63466,4.009529894,Jason Wu  is a Taiwanese Canadian fashion designer based in New York City,73China,Arts/Entertainment,Justin Lo,63429,4.009167557,"Justin Lo  is a Hong Kong American singer-songwriter, actor and record producer working in Hong Kong",100China,Literature,Maxine Hong Kingston,63399,4.008873615,"Maxine Hong Kingston  is a Chinese American author and Professor Emerita at the University of California, Berkeley, where she graduated with a BA in English in 1962",164China,Sports,Rudy Gunawan,63378,4.008667772,Rudy Gunawan   is a well-known Indonesian badminton player in the era of the late 1980s and early 1990s,103China,Government,Allan Fung,62558,4.000576331,"Allan W  Fung   is an American attorney, politician and member of the Republican Party who has served as the Mayor of Cranston, Rhode Island since 2009 and is the Republican nominee for Governor of Rhode Island in the 2014 election",231China,Arts/Entertainment,Anna Sui,62274,3.997749181,Anna Sui  is an American fashion designer,41China,Business/Technology,Li Lu,62037,3.995380017,"Li Lu  is a Chinese-born American investment banker, investor and fund manager based in the United States",105China,Business/Technology,Weili Dai,61969,3.994698586,Weili Dai  is president and co-founder of Marvell Technology Group,66China,Other,Edward Lu,61526,3.990240874,"Edward Tsang ""Ed"" Lu  is a U",28China,Arts/Entertainment,Ming Tsai,61243,3.987376338,"Ming Tsai  is an American restaurateur, television personality, and celebrity chef of fusion cuisine",100China,Arts/Entertainment,Tyson Beckford,61086,3.985781465,"Tyson Beckford  is an American fashion model and actor, best known as a Ralph Lauren Polo model",95China,Government,Susan C. Lee,60862,3.983498866,Susan Clair Lee  is a member of the Maryland State Senate,57China,Literature,Ha Jin,60646,3.981289818,J_n Xu_f_i  is a contemporary Chinese-American poet and novelist using the pen name Ha Jin ,91China,Other,Betty Ong,59982,3.97444944,"Betty Ann Ong  was an American flight attendant onboard American Airlines Flight 11 when it was hijacked and flown into the North Tower of the World Trade Center in New York City, as part of the September 11 attacks",215China,Literature,Marilyn Chin,59911,3.973713538,"Marilyn Chin  is a prominent Chinese American  poet and writer, an activist  and feminist   , an editor and Professor of English",128China,Business/Technology,John S. Chen,59816,3.972727514,John S  Chen  is the CEO of BlackBerry Ltd,42China,Government,Dolly M. Gee,59767,3.972218321,Dolly Maizie Gee  is a United States district judge on the United States District Court for the Central District of California,126China,Business/Technology,Steve Chen,59340,3.967763316,"Steven Shih ""Steve"" Chen  is a Taiwanese-born American internet entrepreneur",76China,Arts/Entertainment,Harry Shum,58902,3.963160113,"Heung-Yeung ""Harry"" Shum  is Executive Vice President, Technology &amp; Research at Microsoft",93China,Arts/Entertainment,Bright Sheng,58864,3.962759136,"Bright Sheng  is a Chinese-American composer, conductor, and pianist",68