Source Country,Field Of Influence,Name,Influence,log(influence),Description,UnknownGermany,Literature,Walter Lippman,133650,4.472250517,"Walter Lippmann  was an American writer, reporter, and political commentator famous for being among the first to introduce the concept of Cold War, coining the term ""stereotype"" in the modern psychological meaning, and critiquing media and democracy in his newspaper column and several books, most notably his 1922 book Public Opinion",334Germany,Religion,Donald Wuerl,133527,4.47167843,Donald William Wuerl  is an American cardinal of the Catholic Church,68Germany,Sports,Geoff Schwartz,133491,4.47151089,"Geoffrey Isaiah ""Geoff"" Schwartz  is an American football offensive guard for the New York Giants of the National Football League ",130Germany,Sports,Harry Heilmann,133047,4.469440844,"Harry Edwin Heilmann , nicknamed ""Slug,"" was a Major League Baseball player who played 17 seasons with the Detroit Tigers  and Cincinnati Reds ",143Germany,Academia/Science,Katherine Esau,132918,4.468838117,Katherine Esau  was a German-American botanist who received the National Medal of Science for her work on plant anatomy,119Germany,Government,Brian Schweitzer,132364,4.466242991,"Brian David Schweitzer  is an American politician who served as the 23rd Governor of Montana from January 5, 2005 to January 7, 2013",132Germany,Arts/Entertainment,Kim Basinger,132243,4.465674741,"Kimila Ann ""Kim"" Basinger  is an American actress and former fashion model",74Germany,Other,Dutch Schultz,131790,4.463542697,"Dutch Schultz  was a New York City-area German Jewish-American mobster of the 1920s and 1930s who made his fortune in organized crime-related activities, including bootlegging and the numbers racket",198Germany,Arts/Entertainment,Paul Dresser,131120,4.460375869,"Paul Dresser  was an American singer, songwriter, and comedic actor of the late nineteenth and early twentieth centuries",120Germany,Arts/Entertainment,Eddie Albert,130820,4.458952638,"Edward Albert Heimberger , known professionally as Eddie Albert, was an American actor and activist",99Germany,Sports,Bob Falkenburg,130668,4.458230288,"Robert ""Bob"" Falkenburg  is a former American amateur tennis player and entrepreneur",84Germany,Sports,John Schuerholz,130300,4.456477955,John Schuerholz  is the President of the Atlanta Braves of the National League,78Germany,Literature,Erich Maria Remarque,130234,4.456163155,"Erich Maria Remarque , born Erich Paul Remark, was a German author who created many works, with his best-known novel being All Quiet on the Western Front",153Germany,Arts/Entertainment,J. C. Leyendecker,130226,4.456124986,Joseph Christian Leyendecker  was one of the preeminent American illustrators of the early 20th century,103Germany,Sports,Jonathan Spector,129072,4.450594475,Jonathan Michael Paul Spector  is an American soccer player who plays as a defender for Birmingham City,103Germany,Sports,Bob Meusel,128887,4.449703272,"Robert William ""Bob"" Meusel  was an American baseball left and right fielder who played in Major League Baseball  for eleven seasons from 1920 through 1930, all but the last for the New York Yankees",198Germany,Sports,Rick Neuheisel,128492,4.447796143,"Richard Gerald ""Rick"" Neuheisel, Jr",35Germany,Sports,Katie Hoff,127619,4.443560264,"Kathryn Elise Hoff  is an American competition swimmer, Olympic medalist, and former world record-holder",104Germany,Academia/Science,Frederick Seitz,126990,4.440490298,Frederick Seitz  was an American physicist and a pioneer of solid state physics,79Germany,Literature,Wolfgang Reitherman,126973,4.440407116,"Wolfgang Reitherman , also known and sometimes credited as Woolie Reitherman, was a Disney animator and one of Disney's Nine Old Men",132Germany,Sports,Scott Schoeneweis,126567,4.438417195,Scott David Schoeneweis  is an American former Major League Baseball left-handed relief pitcher,95Germany,Arts/Entertainment,Edward Herrmann,126095,4.436095751,"Edward Kirk Herrmann  was an American actor, director, writer, and comedian, best known for his Emmy-nominated portrayals of Franklin D",135Germany,Sports,Ray Schalk,125941,4.43533645,"Raymond William Schalk  was an American professional baseball player, coach, manager and scout",94Germany,Sports,Todd Marinovich,125832,4.434798461,Todd Marvin Marinovich  is a former American and Canadian football quarterback,78Germany,Literature,Fritz Leiber,125755,4.434418133,,0Germany,Sports,Billy Wagner,125670,4.43399802,"William Edward Wagner , nicknamed ""Billy the Kid"", is a former Major League Baseball relief pitcher",99Germany,Arts/Entertainment,Nick Nolte,125559,4.433448973,"Nicholas King ""Nick"" Nolte  is an American actor",48Germany,Government,Denny Rehberg,125512,4.433216348,"Dennis Ray ""Denny"" Rehberg  is an American politician and member of the Republican Party",88Germany,Academia/Science,Michael Heidelberger,125244,4.431888222,Michael Heidelberger ForMemRS  was an American immunologist who is regarded as the father of modern immunology,110Germany,Arts/Entertainment,Jeff Hanneman,124920,4.430278776,"Jeffrey John ""Jeff"" Hanneman  was an American musician, best known as a founding member of the American thrash metal band Slayer",128Germany,Sports,Gertrude Ederle,124831,4.429835945,"Gertrude Caroline Ederle  was an American competition swimmer, Olympic champion, and former world record-holder in five events",126Germany,Sports,Jordan Schroeder,124649,4.428929395,Jordan John Schroeder  is an American professional ice hockey center,68Germany,Religion,Albert Gregory Meyer,123815,4.424758205,"Albert Gregory Meyer  was an American prelate of the Roman Catholic Church who served as the Archbishop of the Archdiocese of Chicago from 1958 until his death in 1965, and was appointed a cardinal in 1959",205Germany,Sports,Tom Weiskopf,122550,4.418377465,Thomas Daniel Weiskopf  is an American professional golfer who played on the PGA Tour and the Champions Tour,108Germany,Other,Jack Swigert,122015,4.415659048,"John Leonard ""Jack"" Swigert, Jr",31Germany,Literature,Joseph Pulitzer,120883,4.409867677,"Joseph Pulitzer , born Pulitzer József, was a Hungarian-born American newspaper publisher of the St",99Germany,Arts/Entertainment,Carol Channing,120781,4.409343179,"Carol Elaine Channing  is an American actress, singer, dancer, comedian, and voice artist",89Germany,Arts/Entertainment,Donna Reed,119919,4.404892884,Donna Reed  was an American film and television actress and producer,68Germany,Sports,Dave Butz,119530,4.402874087,David Butz  is a former American Football defensive lineman in the National Football League who played for the St,113Germany,Government,Gustav Koerner,119209,4.401203236,"Gustav Philipp Koerner, also spelled Gustave or Gustavus Koerner  was a revolutionary, journalist, lawyer, politician, judge, and statesman in Illinois and Germany and a Colonel of the U",186Germany,Sports,Nicole Barnhart,118768,4.398900417,"Nicole Renee Barnhart  is an American soccer goalkeeper, and a two-time Olympic gold medalist who currently plays for FC Kansas City in the National Women's Soccer League",170Germany,Government,Warren E. Burger,118744,4.398774848,Warren Earl Burger  was the 15th Chief Justice of the United States from 1969 to 1986,85Germany,Arts/Entertainment,Albert Bierstadt,118168,4.39575356,"Albert Bierstadt  was an American painter best known for his lavish, sweeping landscapes of the American West",109Germany,Sports,Lon Kruger,117886,4.394269014,Lonnie Duane Kruger  is an American college and professional basketball coach who is currently the men's basketball head coach of the University of Oklahoma,156Germany,Sports,Chris Kaman,117193,4.390605681,Christopher Zane Kaman  is an American-German professional basketball player who currently plays for the Portland Trail Blazers of the NBA,138Germany,Arts/Entertainment,Paul Stanley,117027,4.389724957,"Stanley Bert Eisen , better known by his stage name Paul Stanley, is an American hard rock guitarist, singer, and painter, best known for being the frontman of the rock band Kiss",178Germany,Government,Robert F. Wagner,116339,4.386061358,Robert Ferdinand Wagner I  was an American politician,53Germany,Arts/Entertainment,Kaley Cuoco,115426,4.38116604,"Kaley Christine Cuoco-Sweeting  is an American actress, known for her roles as Bridget Hennessy on the ABC sitcom 8 Simple Rules , Billie Jenkins on the final season of the supernatural drama series Charmed  and Penny on the CBS comedy series The Big Bang Theory  for which she won a Critics' Choice Television Award in 2013 and a People's Choice Award in 2014",360Germany,Literature,Henry Villard,115391,4.380977607,Henry Villard  was an American journalist and financier who was an early president of the Northern Pacific Railway,114Germany,Arts/Entertainment,Lawrence Welk,114723,4.377370239,"Lawrence Welk  was an American musician, accordionist, bandleader, and television impresario, who hosted The Lawrence Welk Show from 1951 to 1982",145Germany,Sports,Dave Krieg,114463,4.375960492,David Michael Krieg  is a former American football quarterback in the National Football League,94Germany,Arts/Entertainment,Actress,114295,4.375047875,"An actor  is a person portraying a character in a dramatic or comic production; he or she performs in film, television, theatre, or radio",137Germany,Business/Technology,Ralph Baer,113810,4.372405689,"Ralph Henry Baer  was a German-born American video game developer, inventor, and engineer, and was known as ""The Father of Video Games"" due to his many contributions to games and the video game industry in the latter half of the 20th century",241Germany,Academia/Science,Gunther E. Rothenberg,113802,4.372362012,"Gunther Erich Rothenberg  was an internationally known military historian, best known for his publications on the Habsburg military and Napoleonic Wars",151Germany,Government,Richard Schultz Schweiker,113276,4.369483506,Richard Schultz Schweiker  is an American politician,52Germany,Sports,Nick Markakis,113232,4.369242112,"Nicholas William ""Nick"" Markakis ; born November 17, 1983 is an American professional baseball outfielder for the Atlanta Braves of Major League Baseball ",154Germany,Arts/Entertainment,Josef Albers,111994,4.362411459,"Josef Albers  was a German-born American artist and educator whose work, both in Europe and in the United States, formed the basis of some of the most influential and far-reaching art education programs of the twentieth century",227Germany,Military,Friedrich Wilhelm Ludolf Gerhard Augustin von Steuben,111162,4.35777835,"Friedrich Wilhelm August Heinrich Ferdinand Steuben , also referred to as the Baron von Steuben, was a Prussian-born American military officer",142Germany,Military,Baron von Steuben,111017,4.35696735,"Friedrich Wilhelm August Heinrich Ferdinand Steuben , also referred to as the Baron von Steuben, was a Prussian-born American military officer",142Germany,Sports,Rachel Buehler,110936,4.356513847,"Rachel Buehler Van Hollebeke , née Rachel Marie Buehler, is an American soccer defender currently playing for the Portland Thorns FC and the United States women's national soccer team",183Germany,Military,Carl Andrew Spaatz,110281,4.352834423,"Carl Andrew ""Tooey"" Spaatz  was an American World War II general and the first Chief of Staff of the United States Air Force",124Germany,Other,Jimmy Hoffa,110089,4.351751732,"James Riddle ""Jimmy"" Hoffa  was an American labor union leader who vanished in late July 1975, aged 62",102Germany,Arts/Entertainment,Kat Von D,110029,4.351413003,"Kat Von D , best known as Kat Von D, is a Mexican-born American tattoo artist, model, musician and television personality",121Germany,Sports,"Elroy ""Crazy Legs"" Hirsch",109183,4.346617171,"Elroy ""Crazylegs"" Hirsch  was an American football running back and receiver for the Los Angeles Rams and Chicago Rockets, nicknamed for his unusual running style",162Germany,Arts/Entertainment,Blythe Danner,108864,4.34479916,Blythe Katherine Danner  is an American actress,47Germany,Other,Benjamin C. Bradlee,108673,4.343708081,"Benjamin Crowninshield ""Ben"" Bradlee  was executive editor of The Washington Post from 1968 to 1991",99Germany,Sports,Charlie Getzien,108623,4.343422142,Charles H  Getzein   was an American professional baseball player from 1883 to 1891,83Germany,Sports,Al Groh,108433,4.34233437,"Al Groh  is the former head coach of the University of Virginia football team, the Wake Forest Demon Deacons football team, and the New York Jets of the NFL",156Germany,Sports,Francis Schmidt,108427,4.342299988,"Francis Albert Schmidt  was an American football player and coach of football, basketball, and baseball",103Germany,Sports,Shawn Bradley,108209,4.341049494,"Shawn Paul Bradley  is a retired American and German  basketball player who played center for the Philadelphia 76ers, the New Jersey Nets and the Dallas Mavericks in the National Basketball Association ",202Germany,Arts/Entertainment,Eric Stoltz,108078,4.340296838,"Eric Stoltz  is an American actor, director and producer",56Germany,Business/Technology,Barron Hilton,108053,4.340153097,"William Barron Hilton I  is an American business magnate, socialite, and hotel heir",83Germany,Sports,Matt Spaeth,107802,4.338708098,Matt Spaeth  is an American football tight end for the Pittsburgh Steelers of the National Football League ,107Germany,Literature,Patricia Highsmith,107667,4.337929515,"Patricia Highsmith  was an American novelist and short story writer, most widely known for her psychological thrillers, which led to more than two dozen film adaptations",169Germany,Arts/Entertainment,Peter Dinklage,107423,4.336519819,Peter Hayden Dinklage  is an American actor,43Germany,Sports,Kirk Ferentz,107333,4.335999041,Kirk James Ferentz  is an American football coach and former player,67Germany,Sports,John Kuhn,107155,4.334967769,John Allen Kuhn  is an American football fullback for the Green Bay Packers of the National Football League ,108Germany,Government,Earl Lauer Butz,106792,4.332859352,Earl Lauer Butz  was a United States government official who served as Secretary of Agriculture under Presidents Richard Nixon and Gerald Ford,142Germany,Sports,Josh Wolff,106724,4.33246359,"Joshua David ""Josh"" Wolff  is a retired American soccer player who now works as an assistant coach for Columbus Crew of Major League Soccer",139Germany,Other,Ed Schultz,106480,4.331041423,"Edward Andrew ""Ed"" Schultz  is an American television and radio host, a liberal political commentator and a former sports broadcaster",133Germany,Arts/Entertainment,Frances Sternhagen,106343,4.330241483,Frances Hussey Sternhagen  is an American actress,49Germany,Arts/Entertainment,Fritz Lang,106010,4.328292796,"Friedrich Christian Anton ""Fritz"" Lang  was a German-Austrian filmmaker, screenwriter, and occasional film producer and actor",125Germany,Other,August Busch IV,105830,4.327236902,August Adolphus Busch IV  is the former CEO of Anheuser-Busch who ended the family control of the company in 2008 when it was sold to InBev,139Germany,Arts/Entertainment,William Fichtner,105558,4.325637916,William Edward Fichtner  is an American actor,45Germany,Arts/Entertainment,Ray Harryhausen,105527,4.325455417,"Raymond Frederick ""Ray"" Harryhausen  was an American visual effects creator, writer, and producer who created a form of stop-motion model animation known as ""Dynamation",168Germany,Academia/Science,Victor Frederick Weisskopf,105372,4.324542118,"Victor Frederick ""Viki"" Weisskopf  was an Austrian-born American theoretical physicist",86Germany,Sports,Trevor Bauer,105272,4.32395218,Trevor Andrew Bauer  is an American professional baseball pitcher with the Cleveland Indians of Major League Baseball ,118Germany,Sports,Ali Krieger,105095,4.322906614,"Alexandra Blaire ""Ali"" Krieger  is an American soccer player",60Germany,Sports,Bowie Kuhn,104657,4.320311691,"Bowie Kent Kuhn  was an American lawyer and sports administrator who served as the fifth Commissioner of Major League Baseball from February 4, 1969, to September 30, 1984",171Germany,Academia/Science,Karen Horney,104638,4.32019888,Karen Horney  was a German psychoanalyst who practiced in the United States during her later career,99Germany,Sports,Paul Goldschmidt,104400,4.318784039,Paul Edward Goldschmidt  is an American professional baseball first baseman for the Arizona Diamondbacks of Major League Baseball ,130Germany,Sports,J. R. Hildebrand,104147,4.317276486,,0Germany,Sports,Archie Hahn,104137,4.317216824,"Charles Archibald ""Archie"" Hahn  was an American track athlete and one of the best sprinters in the early 20th century",118Germany,Sports,Hank Steinbrenner,103938,4.316028352,"Henry George ""Hank"" Steinbrenner III  is part-owner and co-chairman of the New York Yankees",91Germany,Sports,Edwin Jackson,103860,4.315561898,Edwin Jackson  is an American professional baseball pitcher for the Chicago Cubs of Major League Baseball,105Germany,Arts/Entertainment,George Raft,103838,4.31543027,George Raft  was an American film actor and dancer identified with portrayals of gangsters in crime melodramas of the 1930s and 1940s,133Germany,Business/Technology,John Jacob Astor IV,103535,4.31361456,"John Jacob ""Jack"" Astor IV , often dubbed ""Jack Ass"" in the press, was an American businessman, real estate builder, investor, inventor, writer, lieutenant colonel in the Spanish",178Germany,Arts/Entertainment,Elisabet Ney,103505,4.313434498,"Franzisca Bernadina Wilhelmina Elisabeth Ney  was a celebrated German-born sculptor who spent the first half of her life and career in Europe, producing sculpted works of famous leaders such as Otto von Bismarck, Giuseppe Garibaldi and King George V of Hanover",260Germany,Arts/Entertainment,John Frankenheimer,103288,4.312130491,John Michael Frankenheimer  was an American film and television director known for social dramas and action/suspense films,122Germany,Arts/Entertainment,Marg Helgenberger,103152,4.311311836,Mary Marg Helgenberger  is an American actress,46Germany,Arts/Entertainment,Dan Auerbach,103070,4.310817714,"Daniel Quine ""Dan"" Auerbach  is an American musician and record producer best known as the guitarist and vocalist for The Black Keys, a blues rock band from Akron, Ohio",168Germany,Academia/Science,David Rittenhouse,102975,4.310244763,"David Rittenhouse  was a renowned American astronomer, inventor, clockmaker, mathematician, surveyor, scientific instrument craftsman and public official",153Germany,Arts/Entertainment,John Ratzenberger,102953,4.310112004,"John Deszo Ratzenberger  is an American actor, voice actor, and entrepreneur",76Germany,Sports,Kyle Beckerman,102634,4.308183808,Kyle Robert Beckerman  is an American soccer player who plays for Real Salt Lake in Major League Soccer  and the United States national team,140Germany,Arts/Entertainment,Walter Gropius,102619,4.308092993,"Walter Adolph Georg Gropius  was a German architect and founder of the Bauhaus School, who, along with Ludwig Mies van der Rohe, Le Corbusier and Frank Lloyd Wright, is widely regarded as one of the pioneering masters of modern architecture",240Germany,Arts/Entertainment,Roy Scheider,102297,4.306140291,Roy Richard Scheider  was an American actor and amateur boxer,61Germany,Academia/Science,Rusty Schweickart,102249,4.305848678,"Russell Louis ""Rusty"" Schweickart  is an American aeronautical engineer, and a former NASA astronaut, research scientist, Air Force fighter pilot, as well as a former business executive and government executive",210Germany,Arts/Entertainment,Elle Fanning,102247,4.305836525,Mary Elle Fanning  is an American teen actress,46Germany,Arts/Entertainment,Dee Dee Ramone,101561,4.30165379,"Douglas Glenn Colvin , known professionally as Dee Dee Ramone, was a German-American songwriter and musician, best known as founding member, songwriter and bassist for punk rock band the Ramones",194Germany,Arts/Entertainment,Ubbe Ert Iwwerks,101381,4.3005516,,0Germany,Government,H. John Heinz III,101251,4.299754356,Henry John Heinz III  was an American politician from Pennsylvania,66Germany,Government,William Goebel,101065,4.298611903,William Justus Goebel  was an American politician who served as the 34th Governor of Kentucky for four days in 1900 after having been mortally wounded by an assassin the day before he was sworn in,196Germany,Business/Technology,Walter Chrysler,100881,4.297479663,"Walter Percy Chrysler  was an American automotive industry executive and founder of Chrysler Corporation, now a part of Fiat Chrysler Automobiles",145Germany,Arts/Entertainment,Nate Ruess,100835,4.29719628,"Nathaniel Joseph ""Nate"" Ruess  is an American singer-songwriter and musician",76Germany,Arts/Entertainment,Van Johnson,100704,4.296388547,Van Johnson  was an American film and television actor and dancer who was a major star at Metro-Goldwyn-Mayer during and after World War II,139Germany,Academia/Science,Adam Steltzner,100441,4.294763737,Adam Diedrich Steltzner  is an American NASA engineer who works for the Jet Propulsion Laboratory ,98Germany,Business/Technology,Otto Hermann Kahn,99983,4.291924038,"Otto Hermann Kahn  was an investment banker, collector, philanthropist, and patron of the arts",94Germany,Arts/Entertainment,Paul Hindemith,99901,4.291414248,"Paul Hindemith  was a German composer, violist, violinist, teacher and conductor",80Germany,Other,John Wanamaker,99833,4.290991177,"John Wanamaker  was a United States merchant, religious leader, civic and political figure, considered by some to be a proponent of advertising and a ""pioneer in marketing",171Germany,Arts/Entertainment,Russ Meyer,99753,4.290493078,"Russell Albion ""Russ"" Meyer  was an American film director, producer, screenwriter, cinematographer, film editor, actor and photographer",136Germany,Sports,Zach Mettenberger,99551,4.289233598,Zach Mettenberger  is an American football quarterback for the Tennessee Titans of the National Football League ,112Germany,Arts/Entertainment,Kellan Lutz,99267,4.287458515,Kellan Christopher Lutz  is an American model and actor,55Germany,Business/Technology,John Doerr,99004,4.285810153,"L  John Doerr  is an American venture capitalist at Kleiner Perkins Caufield &amp; Byers in Menlo Park, California, in Silicon Valley",133Germany,Academia/Science,Charles Proteus Steinmetz,98873,4.284987472,Charles Proteus Steinmetz  was a German-born American mathematician and electrical engineer,91Germany,Literature,Theodore Dreiser,98646,4.283559325,Theodore Herman Albert Dreiser  was an American novelist and journalist of the naturalist school,96Germany,Arts/Entertainment,Julie Bowen,98087,4.280028375,"Julie Bowen Luetkemeyer , better known as Julie Bowen, is an American actress",77Germany,Military,Dieter Dengler,98039,4.279724243,Dieter Dengler  was a German-born United States Navy Naval aviator during the Vietnam War ,90Germany,Business/Technology,John Jacob Astor,97650,4.277254001,"John Jacob Astor , born Johann Jakob Astor, was a German-born American businessman, merchant, fur trader, and investor who was the first prominent member of the Astor family and the first multi-millionaire in the United States",226Germany,Literature,Howard Kurtz,97297,4.275003836,"Howard ""Howie"" Alan Kurtz  is an American journalist and author with a special focus on the media",97Germany,Business/Technology,Bernard Baruch,97032,4.273309247,"Bernard Mannes Baruch  was an American financier, stock investor, philanthropist, statesman, and political consultant",117Germany,Arts/Entertainment,Otto Klemperer,96922,4.272604473,Otto Klemperer  was a German conductor and composer,51Germany,Sports,Whitney Engen,96848,4.272129903,Whitney Elizabeth Engen  is an American professional soccer player who plays for the Western New York Flash of the National Women's Soccer League  and the United States women's national soccer team,197Germany,Sports,Jim Zorn,96608,4.270588255,"James Arthur ""Jim"" Zorn  is a former American Football player and coach in the National Football League",103Germany,Sports,Noodles Hahn,96327,4.268778369,"Frank George ""Noodles"" Hahn  was a starting pitcher in Major League Baseball who played for the Cincinnati Reds and New York Highlanders between 1899 and 1906",158Germany,Arts/Entertainment,Emanuel Leutze,96294,4.268565473,Emanuel Gottlieb Leutze  was a German American history painter best known for his painting Washington Crossing the Delaware,123Germany,Other,Jacob Leisler,96084,4.267208973,Jacob Leisler  was a German-born American colonist,50Germany,Business/Technology,John J. Raskob,95773,4.265194605,"John Jakob Raskob, KCSG  was a financial executive and businessman for DuPont and General Motors, and the builder of the Empire State Building",142Germany,Arts/Entertainment,William Petersen,95500,4.263420967,"William Louis Petersen  is an American actor and producer, best known for playing Dr",84Germany,Academia/Science,Francis Lieber,95190,4.261400787,"Francis Lieber , known as Franz Lieber in Germany, was a German-American jurist, gymnast and political philosopher",114Germany,Other,Bruno Hauptmann,95149,4.26113311,Bruno Richard Hauptmann  was a German-born carpenter and criminal who was convicted of the abduction and murder of the 20-month-old son of Charles Lindbergh and Anne Morrow Lindbergh,182Germany,Arts/Entertainment,Alida Valli,95066,4.260590873,"Alida Valli , sometimes simply credited as Valli, stage name of Baroness Alida Maria Laura Altenburger von Marckenstein u",121Germany,Arts/Entertainment,Emile Hirsch,95059,4.26054512,"Emile Davenport Hirsch  is an American film actor, whose works include Into the Wild, Lone Survivor, Milk, Prince Avalanche, The Motel Life, Speed Racer and the A&amp;E networks simulcast miniseries Bonnie &amp; Clyde",217